Date,Articles
2014-01-11,"{""abstract"": ""Some funds are trying to copy the investments of successful hedge fund managers and business leaders, but not everyone thinks the approach makes for canny investing."", ""web_url"": ""https://www.nytimes.com/2014/01/12/business/mutfund/guru-funds-mimicking-the-smart-money.html"", ""snippet"": ""Some funds are trying to copy the investments of successful hedge fund managers and business leaders, but not everyone thinks the approach makes for canny investing."", ""lead_paragraph"": ""SUCCESS breeds imitation, whether acknowledged or not. Now, two exchange-traded funds and a mutual fund are being open about their copying: They aim to replicate the investments of the most successful hedge funds and business people. "", ""print_section"": ""BU"", ""print_page"": ""11"", ""source"": ""The New York Times"", ""multimedia"": [{""rank"": 0, ""subtype"": ""xlarge"", ""caption"": null, ""credit"": null, ""type"": ""image"", ""url"": ""images/2014/01/12/business/12-COPY1/12-COPY1-articleLarge.jpg"", ""height"": 413, ""width"": 600, ""subType"": ""xlarge"", ""crop_name"": ""articleLarge"", ""legacy"": {""xlarge"": ""images/2014/01/12/business/12-COPY1/12-COPY1-articleLarge.jpg"", ""xlargewidth"": 600, ""xlargeheight"": 413}}, {""rank"": 0, ""subtype"": ""jumbo"", ""caption"": null, ""credit"": null, ""type"": ""image"", ""url"": ""images/2014/01/12/business/12-COPY1/12-COPY1-jumbo.jpg"", ""height"": 705, ""width"": 1024, ""subType"": ""jumbo"", ""crop_name"": ""jumbo"", ""legacy"": {}}, {""rank"": 0, ""subtype"": ""superJumbo"", ""caption"": null, ""credit"": null, ""type"": ""image"", ""url"": ""images/2014/01/12/business/12-COPY1/12-COPY1-superJumbo.jpg"", ""height"": 1411, ""width"": 2048, ""subType"": ""superJumbo"", ""crop_name"": ""superJumbo"", ""legacy"": {}}, {""rank"": 0, ""subtype"": ""thumbnail"", ""caption"": null, ""credit"": null, ""type"": ""image"", ""url"": ""images/2014/01/12/business/12-COPY1/12-COPY1-thumbStandard.jpg"", ""height"": 75, ""width"": 75, ""subType"": ""thumbnail"", ""crop_name"": ""thumbStandard"", ""legacy"": {""thumbnail"": ""images/2014/01/12/business/12-COPY1/12-COPY1-thumbStandard.jpg"", ""thumbnailwidth"": 75, ""thumbnailheight"": 75}}, {""rank"": 0, ""subtype"": ""thumbLarge"", ""caption"": null, ""credit"": null, ""type"": ""image"", ""url"": ""images/2014/01/12/business/12-COPY1/12-COPY1-thumbLarge.jpg"", ""height"": 150, ""width"": 150, ""subType"": ""thumbLarge"", ""crop_name"": ""thumbLarge"", ""legacy"": {}}], ""headline"": {""main"": ""Guru Funds, Mimicking the Smart Money"", ""kicker"": null, ""content_kicker"": null, ""print_headline"": ""Guru Funds, Mimicking the Smart Money"", ""name"": null, ""seo"": null, ""sub"": null}, ""keywords"": [{""name"": ""subject"", ""value"": ""Mutual Funds"", ""rank"": 2, ""major"": ""N""}, {""name"": ""subject"", ""value"": ""Exchange Traded Funds"", ""rank"": 3, ""major"": ""N""}, {""name"": ""subject"", ""value"": ""Hedge Funds"", ""rank"": 4, ""major"": ""N""}, {""name"": ""subject"", ""value"": ""Stocks and Bonds"", ""rank"": 5, ""major"": ""N""}, {""name"": ""persons"", ""value"": ""Buffett, Warren E"", ""rank"": 6, ""major"": ""N""}, {""name"": ""persons"", ""value"": ""Icahn, Carl C"", ""rank"": 7, ""major"": ""N""}], ""pub_date"": ""2014-01-11T04:20:05+0000"", ""document_type"": ""article"", ""news_desk"": ""SundayBusiness"", ""section_name"": ""Business Day"", ""subsection_name"": ""Mutual Funds"", ""byline"": {""original"": ""By Tim Gray"", ""person"": [{""firstname"": ""Tim"", ""middlename"": null, ""lastname"": ""Gray"", ""qualifier"": null, ""title"": null, ""role"": ""reported"", ""organization"": """", ""rank"": 1}], ""organization"": null}, ""type_of_material"": ""News"", ""_id"": ""nyt://article/a783b8c1-06e2-5d02-8ffe-73d7c7365594"", ""word_count"": 1064, ""uri"": ""nyt://article/a783b8c1-06e2-5d02-8ffe-73d7c7365594""}"
2014-01-22,"{""abstract"": ""The activist investor called on eBay to spin off its PayPal business as he nominated two of his employees as candidates for the board."", ""web_url"": ""https://dealbook.nytimes.com/2014/01/22/icahns-latest-target-ebay/"", ""snippet"": ""The activist investor called on eBay to spin off its PayPal business as he nominated two of his employees as candidates for the board."", ""lead_paragraph"": ""Updated, 7:08 p.m. | As if taking on Apple wasn\u2019t enough, the activist investor Carl C. Icahn has another big technology company in his sights: eBay."", ""print_section"": ""B"", ""print_page"": ""6"", ""source"": ""The New York Times"", ""multimedia"": [{""rank"": 0, ""subtype"": ""xlarge"", ""caption"": null, ""credit"": null, ""type"": ""image"", ""url"": ""images/2014/01/24/business/dbpix-ebay1/dbpix-ebay1-articleLarge.jpg"", ""height"": 400, ""width"": 600, ""subType"": ""xlarge"", ""crop_name"": ""articleLarge"", ""legacy"": {""xlarge"": ""images/2014/01/24/business/dbpix-ebay1/dbpix-ebay1-articleLarge.jpg"", ""xlargewidth"": 600, ""xlargeheight"": 400}}, {""rank"": 0, ""subtype"": ""jumbo"", ""caption"": null, ""credit"": null, ""type"": ""image"", ""url"": ""images/2014/01/24/business/dbpix-ebay1/dbpix-ebay1-jumbo.jpg"", ""height"": 683, ""width"": 1024, ""subType"": ""jumbo"", ""crop_name"": ""jumbo"", ""legacy"": {}}, {""rank"": 0, ""subtype"": ""superJumbo"", ""caption"": null, ""credit"": null, ""type"": ""image"", ""url"": ""images/2014/01/24/business/dbpix-ebay1/dbpix-ebay1-superJumbo.jpg"", ""height"": 1365, ""width"": 2048, ""subType"": ""superJumbo"", ""crop_name"": ""superJumbo"", ""legacy"": {}}, {""rank"": 0, ""subtype"": ""thumbnail"", ""caption"": null, ""credit"": null, ""type"": ""image"", ""url"": ""images/2014/01/24/business/dbpix-ebay1/dbpix-ebay1-thumbStandard.jpg"", ""height"": 75, ""width"": 75, ""subType"": ""thumbnail"", ""crop_name"": ""thumbStandard"", ""legacy"": {""thumbnail"": ""images/2014/01/24/business/dbpix-ebay1/dbpix-ebay1-thumbStandard.jpg"", ""thumbnailwidth"": 75, ""thumbnailheight"": 75}}, {""rank"": 0, ""subtype"": ""thumbLarge"", ""caption"": null, ""credit"": null, ""type"": ""image"", ""url"": ""images/2014/01/24/business/dbpix-ebay1/dbpix-ebay1-thumbLarge.jpg"", ""height"": 150, ""width"": 150, ""subType"": ""thumbLarge"", ""crop_name"": ""thumbLarge"", ""legacy"": {}}], ""headline"": {""main"": ""Icahn Adds eBay to His Targets in Technology"", ""kicker"": ""DealBook"", ""content_kicker"": null, ""print_headline"": ""Icahn Adds eBay To His Targets In Technology"", ""name"": null, ""seo"": null, ""sub"": null}, ""keywords"": [{""name"": ""subject"", ""value"": ""Boards of Directors"", ""rank"": 1, ""major"": ""N""}, {""name"": ""subject"", ""value"": ""Computers and the Internet"", ""rank"": 2, ""major"": ""N""}, {""name"": ""subject"", ""value"": ""Shareholder Rights and Activism"", ""rank"": 3, ""major"": ""N""}, {""name"": ""persons"", ""value"": ""Icahn, Carl C"", ""rank"": 4, ""major"": ""N""}, {""name"": ""organizations"", ""value"": ""eBay Inc"", ""rank"": 5, ""major"": ""N""}, {""name"": ""organizations"", ""value"": ""PayPal"", ""rank"": 6, ""major"": ""N""}], ""pub_date"": ""2014-01-22T21:47:43+0000"", ""document_type"": ""article"", ""news_desk"": """", ""section_name"": ""Business Day"", ""byline"": {""original"": ""By David Gelles"", ""person"": [{""firstname"": ""David"", ""middlename"": null, ""lastname"": ""Gelles"", ""qualifier"": null, ""title"": null, ""role"": ""reported"", ""organization"": """", ""rank"": 1}], ""organization"": null}, ""type_of_material"": ""News"", ""_id"": ""nyt://article/6e52b7b1-6c89-54f0-9497-9d1510aa7a27"", ""word_count"": 423, ""uri"": ""nyt://article/6e52b7b1-6c89-54f0-9497-9d1510aa7a27""}"
2014-01-23,"{""abstract"": ""Lenovo to buy IBM\u2019s low-end server business. | Overseas banks may soon have to raise capital against potential losses for their American units. | A doctor displays faulty memory in SAC insider trading trial. | @GSElevator book to test the appetite for Wall Street expos\u00e9s. | Icahn takes to Twitter."", ""web_url"": ""https://dealbook.nytimes.com/2014/01/23/morning-agenda-lenovo-in-deal-for-ibms-server-unit/"", ""snippet"": ""Lenovo to buy IBM\u2019s low-end server business. | Overseas banks may soon have to raise capital against potential losses for their American units. | A doctor displays faulty memory in SAC insider trading trial. | @GSElevator book to test the appetite..."", ""lead_paragraph"": ""Lenovo announced on Thursday that it would acquire IBM\u2019s low-end server business for $2.3 billion, signaling the successful completion of a deal that fell through a year ago, Neil Gough and David Gelles write in DealBook. The server unit, which includes IBM\u2019s x86 server business, brings in an estimated $5 billion in revenue a year."", ""source"": ""The New York Times"", ""multimedia"": [], ""headline"": {""main"": ""Lenovo in Deal for IBM\u2019s Server Unit"", ""kicker"": ""DealBook"", ""content_kicker"": null, ""print_headline"": """", ""name"": null, ""seo"": null, ""sub"": null}, ""keywords"": [], ""pub_date"": ""2014-01-23T13:27:07+0000"", ""document_type"": ""article"", ""news_desk"": """", ""section_name"": ""Business Day"", ""byline"": {""original"": ""By Sydney Ember"", ""person"": [{""firstname"": ""Sydney"", ""middlename"": null, ""lastname"": ""Ember"", ""qualifier"": null, ""title"": null, ""role"": ""reported"", ""organization"": """", ""rank"": 1}], ""organization"": null}, ""type_of_material"": ""News"", ""_id"": ""nyt://article/797ae27e-b133-5b1d-8c82-5f597c02c153"", ""word_count"": 2516, ""uri"": ""nyt://article/797ae27e-b133-5b1d-8c82-5f597c02c153""}"
2014-01-25,"{""abstract"": ""Trading volume in Herbalife put options \u2014 financial contracts that gain in value as a particular stock price declines \u2014 spiked late last week. Even for a volatile stock like Herbalife, it was enough to make some market experts take notice."", ""web_url"": ""https://dealbook.nytimes.com/2014/01/24/a-spike-in-options-trading-before-herbalifes-stock-fell-2/"", ""snippet"": ""Trading volume in Herbalife put options \u2014 financial contracts that gain in value as a particular stock price declines \u2014 spiked late last week. Even for a volatile stock like Herbalife, it was enough to make some market experts take notice."", ""lead_paragraph"": ""Last week, before a senator released letters that sent the shares of Herbalife into a tailspin, certain investors were positioning themselves to make money if the stock fell."", ""source"": ""The New York Times"", ""multimedia"": [], ""headline"": {""main"": ""A Spike in Options Trading Before Herbalife\u2019s Stock Fell"", ""kicker"": ""DealBook"", ""content_kicker"": null, ""print_headline"": """", ""name"": null, ""seo"": null, ""sub"": null}, ""keywords"": [{""name"": ""subject"", ""value"": ""Ponzi and Pyramid Schemes"", ""rank"": 1, ""major"": ""N""}, {""name"": ""subject"", ""value"": ""Stocks and Bonds"", ""rank"": 2, ""major"": ""N""}, {""name"": ""persons"", ""value"": ""Ackman, William A"", ""rank"": 3, ""major"": ""N""}, {""name"": ""persons"", ""value"": ""Icahn, Carl C"", ""rank"": 4, ""major"": ""N""}, {""name"": ""persons"", ""value"": ""Markey, Edward J"", ""rank"": 5, ""major"": ""N""}, {""name"": ""organizations"", ""value"": ""Herbalife Ltd"", ""rank"": 6, ""major"": ""N""}, {""name"": ""organizations"", ""value"": ""Nu Skin Enterprises, Inc"", ""rank"": 7, ""major"": ""N""}], ""pub_date"": ""2014-01-25T00:38:20+0000"", ""document_type"": ""article"", ""news_desk"": """", ""section_name"": ""Business Day"", ""byline"": {""original"": ""By William Alden"", ""person"": [{""firstname"": ""William"", ""middlename"": null, ""lastname"": ""Alden"", ""qualifier"": null, ""title"": null, ""role"": ""reported"", ""organization"": """", ""rank"": 1}], ""organization"": null}, ""type_of_material"": ""News"", ""_id"": ""nyt://article/6d7d9133-c88c-5cc9-8473-0f2d4957c7ce"", ""word_count"": 493, ""uri"": ""nyt://article/6d7d9133-c88c-5cc9-8473-0f2d4957c7ce""}"
2014-01-28,"{""abstract"": ""Carl C. Icahn took to his favorite broadcasting tool, Twitter, on Tuesday to disclose that he had purchased an additional $500 million shares in the iPhone maker."", ""web_url"": ""https://dealbook.nytimes.com/2014/01/28/as-apple-falls-icahn-raises-his-bet/"", ""snippet"": ""Carl C. Icahn took to his favorite broadcasting tool, Twitter, on Tuesday to disclose that he had purchased an additional $500 million shares in the iPhone maker."", ""lead_paragraph"": ""Wall Street investors were shaken by Apple Inc.\u2019s latest quarterly results. But not Carl C. Icahn."", ""source"": ""The New York Times"", ""multimedia"": [{""rank"": 0, ""subtype"": ""xlarge"", ""caption"": null, ""credit"": null, ""type"": ""image"", ""url"": ""images/2014/01/28/business/dealbook/dbpix-icahn/dbpix-icahn-articleLarge.jpg"", ""height"": 430, ""width"": 600, ""subType"": ""xlarge"", ""crop_name"": ""articleLarge"", ""legacy"": {""xlarge"": ""images/2014/01/28/business/dealbook/dbpix-icahn/dbpix-icahn-articleLarge.jpg"", ""xlargewidth"": 600, ""xlargeheight"": 430}}, {""rank"": 0, ""subtype"": ""jumbo"", ""caption"": null, ""credit"": null, ""type"": ""image"", ""url"": ""images/2014/01/28/business/dealbook/dbpix-icahn/dbpix-icahn-jumbo.jpg"", ""height"": 733, ""width"": 1024, ""subType"": ""jumbo"", ""crop_name"": ""jumbo"", ""legacy"": {}}, {""rank"": 0, ""subtype"": ""superJumbo"", ""caption"": null, ""credit"": null, ""type"": ""image"", ""url"": ""images/2014/01/28/business/dealbook/dbpix-icahn/dbpix-icahn-superJumbo.jpg"", ""height"": 1466, ""width"": 2048, ""subType"": ""superJumbo"", ""crop_name"": ""superJumbo"", ""legacy"": {}}, {""rank"": 0, ""subtype"": ""thumbnail"", ""caption"": null, ""credit"": null, ""type"": ""image"", ""url"": ""images/2014/01/28/business/dealbook/dbpix-icahn/dbpix-icahn-thumbStandard.jpg"", ""height"": 75, ""width"": 75, ""subType"": ""thumbnail"", ""crop_name"": ""thumbStandard"", ""legacy"": {""thumbnail"": ""images/2014/01/28/business/dealbook/dbpix-icahn/dbpix-icahn-thumbStandard.jpg"", ""thumbnailwidth"": 75, ""thumbnailheight"": 75}}, {""rank"": 0, ""subtype"": ""thumbLarge"", ""caption"": null, ""credit"": null, ""type"": ""image"", ""url"": ""images/2014/01/28/business/dealbook/dbpix-icahn/dbpix-icahn-thumbLarge.jpg"", ""height"": 150, ""width"": 150, ""subType"": ""thumbLarge"", ""crop_name"": ""thumbLarge"", ""legacy"": {}}], ""headline"": {""main"": ""As Apple Shares Fall, Icahn Plucks More"", ""kicker"": ""DealBook"", ""content_kicker"": null, ""print_headline"": """", ""name"": null, ""seo"": null, ""sub"": null}, ""keywords"": [{""name"": ""persons"", ""value"": ""Icahn, Carl C"", ""rank"": 1, ""major"": ""N""}, {""name"": ""organizations"", ""value"": ""Apple Inc"", ""rank"": 2, ""major"": ""N""}], ""pub_date"": ""2014-01-28T17:26:47+0000"", ""document_type"": ""article"", ""news_desk"": """", ""section_name"": ""Business Day"", ""byline"": {""original"": ""By Michael J. de la Merced"", ""person"": [{""firstname"": ""Michael"", ""middlename"": ""J."", ""lastname"": ""de la Merced"", ""qualifier"": null, ""title"": null, ""role"": ""reported"", ""organization"": """", ""rank"": 1}], ""organization"": null}, ""type_of_material"": ""News"", ""_id"": ""nyt://article/888d269c-349e-5caf-b73c-2a69150a9e49"", ""word_count"": 153, ""uri"": ""nyt://article/888d269c-349e-5caf-b73c-2a69150a9e49""}"
2014-02-10,"{""abstract"": ""The activist investor Carl C. Icahn\u2019s six-month campaign for Apple to increase shareholder payouts ended as other major investors voiced opposition, but Mr. Icahn still claimed a victory of sorts."", ""web_url"": ""https://dealbook.nytimes.com/2014/02/10/icahn-backs-off-apple-buyback-proposal/"", ""snippet"": ""The activist investor Carl C. Icahn\u2019s six-month campaign for Apple to increase shareholder payouts ended as other major investors voiced opposition, but Mr. Icahn still claimed a victory of sorts."", ""lead_paragraph"": ""Updated, 8:52 p.m. | After six months of urging Apple to pay out more money to shareholders, the billionaire Carl C. Icahn dropped his effort on Monday."", ""print_section"": ""B"", ""print_page"": ""4"", ""source"": ""The New York Times"", ""multimedia"": [{""rank"": 0, ""subtype"": ""xlarge"", ""caption"": null, ""credit"": null, ""type"": ""image"", ""url"": ""images/2014/02/11/business/dbpix-apple2/dbpix-apple2-articleLarge.jpg"", ""height"": 400, ""width"": 600, ""subType"": ""xlarge"", ""crop_name"": ""articleLarge"", ""legacy"": {""xlarge"": ""images/2014/02/11/business/dbpix-apple2/dbpix-apple2-articleLarge.jpg"", ""xlargewidth"": 600, ""xlargeheight"": 400}}, {""rank"": 0, ""subtype"": ""jumbo"", ""caption"": null, ""credit"": null, ""type"": ""image"", ""url"": ""images/2014/02/11/business/dbpix-apple2/dbpix-apple2-jumbo.jpg"", ""height"": 683, ""width"": 1024, ""subType"": ""jumbo"", ""crop_name"": ""jumbo"", ""legacy"": {}}, {""rank"": 0, ""subtype"": ""superJumbo"", ""caption"": null, ""credit"": null, ""type"": ""image"", ""url"": ""images/2014/02/11/business/dbpix-apple2/dbpix-apple2-superJumbo.jpg"", ""height"": 1365, ""width"": 2048, ""subType"": ""superJumbo"", ""crop_name"": ""superJumbo"", ""legacy"": {}}, {""rank"": 0, ""subtype"": ""thumbnail"", ""caption"": null, ""credit"": null, ""type"": ""image"", ""url"": ""images/2014/02/11/business/dbpix-apple2/dbpix-apple2-thumbStandard.jpg"", ""height"": 75, ""width"": 75, ""subType"": ""thumbnail"", ""crop_name"": ""thumbStandard"", ""legacy"": {""thumbnail"": ""images/2014/02/11/business/dbpix-apple2/dbpix-apple2-thumbStandard.jpg"", ""thumbnailwidth"": 75, ""thumbnailheight"": 75}}, {""rank"": 0, ""subtype"": ""thumbLarge"", ""caption"": null, ""credit"": null, ""type"": ""image"", ""url"": ""images/2014/02/11/business/dbpix-apple2/dbpix-apple2-thumbLarge.jpg"", ""height"": 150, ""width"": 150, ""subType"": ""thumbLarge"", ""crop_name"": ""thumbLarge"", ""legacy"": {}}], ""headline"": {""main"": ""Icahn Ends Call for Apple Stock Buyback"", ""kicker"": ""DealBook"", ""content_kicker"": null, ""print_headline"": ""Icahn Ends Call for Apple Stock Buyback "", ""name"": null, ""seo"": null, ""sub"": null}, ""keywords"": [{""name"": ""subject"", ""value"": ""Shareholder Rights and Activism"", ""rank"": 1, ""major"": ""N""}, {""name"": ""persons"", ""value"": ""Icahn, Carl C"", ""rank"": 2, ""major"": ""N""}, {""name"": ""persons"", ""value"": ""Stringer, Scott M"", ""rank"": 3, ""major"": ""N""}, {""name"": ""organizations"", ""value"": ""Apple Inc"", ""rank"": 4, ""major"": ""N""}, {""name"": ""organizations"", ""value"": ""California Public Employees Retirement System"", ""rank"": 5, ""major"": ""N""}, {""name"": ""organizations"", ""value"": ""Institutional Shareholder Services Inc"", ""rank"": 6, ""major"": ""N""}, {""name"": ""organizations"", ""value"": ""Office of the Comptroller (NYC)"", ""rank"": 7, ""major"": ""N""}], ""pub_date"": ""2014-02-10T15:19:32+0000"", ""document_type"": ""article"", ""news_desk"": """", ""section_name"": ""Business Day"", ""byline"": {""original"": ""By Michael J. de la Merced"", ""person"": [{""firstname"": ""Michael"", ""middlename"": ""J."", ""lastname"": ""de la Merced"", ""qualifier"": null, ""title"": null, ""role"": ""reported"", ""organization"": """", ""rank"": 1}], ""organization"": null}, ""type_of_material"": ""News"", ""_id"": ""nyt://article/ca864f3f-4f25-5f5f-9d0e-e1375eb2faa4"", ""word_count"": 575, ""uri"": ""nyt://article/ca864f3f-4f25-5f5f-9d0e-e1375eb2faa4""}"
2014-02-18,"{""abstract"": ""Actavis is not alone in its penchant for acquisitions, Robert Cyran writes for Reuters Breakingviews. Valeant Pharmaceuticals and Endo Health Solutions are among those that have also enhanced their market values by snatching up rivals, slashing costs and minimizing taxes."", ""web_url"": ""https://dealbook.nytimes.com/2014/02/18/actavis-deal-may-become-the-standard-for-drug-deals/"", ""snippet"": ""Actavis is not alone in its penchant for acquisitions, Robert Cyran writes for Reuters Breakingviews. Valeant Pharmaceuticals and Endo Health Solutions are among those that have also enhanced their market values by snatching up rivals, slashing co..."", ""lead_paragraph"": ""Actavis makes pharmaceutical deals look generic. Its $25 billion acquisition of Forest Laboratories follows a familiar formula in the sector. Agitating investor? Check. Low-tax jurisdiction? Check. Buyer\u2019s stock rises? Check. And with over $8 billion of value created, financiers will keep busy with their own merger success."", ""source"": ""The New York Times"", ""multimedia"": [{""rank"": 0, ""subtype"": ""xlarge"", ""caption"": null, ""credit"": null, ""type"": ""image"", ""url"": ""images/2014/02/19/business/dbpix-breakingviews-drug/dbpix-breakingviews-drug-articleLarge.jpg"", ""height"": 569, ""width"": 600, ""subType"": ""xlarge"", ""crop_name"": ""articleLarge"", ""legacy"": {""xlarge"": ""images/2014/02/19/business/dbpix-breakingviews-drug/dbpix-breakingviews-drug-articleLarge.jpg"", ""xlargewidth"": 600, ""xlargeheight"": 569}}, {""rank"": 0, ""subtype"": ""jumbo"", ""caption"": null, ""credit"": null, ""type"": ""image"", ""url"": ""images/2014/02/19/business/dbpix-breakingviews-drug/dbpix-breakingviews-drug-jumbo.jpg"", ""height"": 971, ""width"": 1024, ""subType"": ""jumbo"", ""crop_name"": ""jumbo"", ""legacy"": {}}, {""rank"": 0, ""subtype"": ""superJumbo"", ""caption"": null, ""credit"": null, ""type"": ""image"", ""url"": ""images/2014/02/19/business/dbpix-breakingviews-drug/dbpix-breakingviews-drug-superJumbo.jpg"", ""height"": 1235, ""width"": 1302, ""subType"": ""superJumbo"", ""crop_name"": ""superJumbo"", ""legacy"": {}}, {""rank"": 0, ""subtype"": ""thumbnail"", ""caption"": null, ""credit"": null, ""type"": ""image"", ""url"": ""images/2014/02/19/business/dbpix-breakingviews-drug/dbpix-breakingviews-drug-thumbStandard.jpg"", ""height"": 75, ""width"": 75, ""subType"": ""thumbnail"", ""crop_name"": ""thumbStandard"", ""legacy"": {""thumbnail"": ""images/2014/02/19/business/dbpix-breakingviews-drug/dbpix-breakingviews-drug-thumbStandard.jpg"", ""thumbnailwidth"": 75, ""thumbnailheight"": 75}}, {""rank"": 0, ""subtype"": ""thumbLarge"", ""caption"": null, ""credit"": null, ""type"": ""image"", ""url"": ""images/2014/02/19/business/dbpix-breakingviews-drug/dbpix-breakingviews-drug-thumbLarge.jpg"", ""height"": 150, ""width"": 150, ""subType"": ""thumbLarge"", ""crop_name"": ""thumbLarge"", ""legacy"": {}}], ""headline"": {""main"": ""Actavis Deal May Become the Standard for Drug Deals"", ""kicker"": ""DealBook"", ""content_kicker"": null, ""print_headline"": """", ""name"": null, ""seo"": null, ""sub"": null}, ""keywords"": [{""name"": ""subject"", ""value"": ""Drugs (Pharmaceuticals)"", ""rank"": 1, ""major"": ""N""}, {""name"": ""subject"", ""value"": ""Mergers, Acquisitions and Divestitures"", ""rank"": 2, ""major"": ""N""}, {""name"": ""persons"", ""value"": ""Icahn, Carl C"", ""rank"": 3, ""major"": ""N""}, {""name"": ""organizations"", ""value"": ""Actavis Group"", ""rank"": 4, ""major"": ""N""}, {""name"": ""organizations"", ""value"": ""Endo Pharmaceuticals Holdings Inc"", ""rank"": 5, ""major"": ""N""}, {""name"": ""organizations"", ""value"": ""Forest Laboratories Inc"", ""rank"": 6, ""major"": ""N""}, {""name"": ""organizations"", ""value"": ""Valeant Pharmaceuticals International Inc"", ""rank"": 7, ""major"": ""N""}, {""name"": ""organizations"", ""value"": ""Warner Chilcott Ltd"", ""rank"": 8, ""major"": ""N""}, {""name"": ""organizations"", ""value"": ""Watson Pharmaceuticals Inc"", ""rank"": 9, ""major"": ""N""}], ""pub_date"": ""2014-02-18T19:41:38+0000"", ""document_type"": ""article"", ""news_desk"": ""Business"", ""section_name"": ""Business Day"", ""byline"": {""original"": ""By Robert Cyran"", ""person"": [{""firstname"": ""Robert"", ""middlename"": null, ""lastname"": ""Cyran"", ""qualifier"": null, ""title"": null, ""role"": ""reported"", ""organization"": """", ""rank"": 1}], ""organization"": null}, ""type_of_material"": ""News"", ""_id"": ""nyt://article/31ffba4b-9b38-5ba5-b1e4-237984ffa4eb"", ""word_count"": 378, ""uri"": ""nyt://article/31ffba4b-9b38-5ba5-b1e4-237984ffa4eb""}"
