Date,Articles
2009-10-17,"{""abstract"": ""The company of the home d\u00e9cor doyenne will allow its agreement with Kmart to lapse, just as it begins selling its products in Home Depot in January."", ""web_url"": ""https://www.nytimes.com/2009/10/17/business/17martha.html"", ""snippet"": ""The company of the home d\u00e9cor doyenne will allow its agreement with Kmart to lapse, just as it begins selling its products in Home Depot in January."", ""lead_paragraph"": ""Martha Stewart Living Omnimedia said on Friday it was unable to agree to terms with Kmart that would have allowed their partnership to continue."", ""print_section"": ""B"", ""print_page"": ""4"", ""source"": ""The New York Times"", ""multimedia"": [{""rank"": 0, ""subtype"": ""thumbnail"", ""caption"": null, ""credit"": null, ""type"": ""image"", ""url"": ""images/2009/10/17/business/martha_75.jpg"", ""height"": 75, ""width"": 75, ""subType"": ""thumbnail"", ""crop_name"": ""thumbStandard"", ""legacy"": {""thumbnail"": ""images/2009/10/17/business/martha_75.jpg"", ""thumbnailwidth"": 75, ""thumbnailheight"": 75}}], ""headline"": {""main"": ""Martha Stewart Fails to Reach New Partnership With Kmart"", ""kicker"": null, ""content_kicker"": null, ""print_headline"": ""Martha Stewart Fails to Reach New Partnership With Kmart"", ""name"": null, ""seo"": null, ""sub"": null}, ""keywords"": [{""name"": ""subject"", ""value"": ""Shopping and Retail"", ""rank"": 1, ""major"": ""N""}, {""name"": ""organizations"", ""value"": ""Kmart Corp"", ""rank"": 2, ""major"": ""N""}, {""name"": ""organizations"", ""value"": ""Home Depot Inc"", ""rank"": 3, ""major"": ""N""}, {""name"": ""subject"", ""value"": ""Housing and Real Estate"", ""rank"": 4, ""major"": ""N""}, {""name"": ""persons"", ""value"": ""Stewart, Martha"", ""rank"": 5, ""major"": ""N""}], ""pub_date"": ""2009-10-17T00:58:37+0000"", ""document_type"": ""article"", ""news_desk"": ""Business"", ""section_name"": ""Business Day"", ""byline"": {""original"": ""By Bloomberg News"", ""person"": [{""firstname"": ""Bloomberg"", ""middlename"": null, ""lastname"": ""News"", ""qualifier"": null, ""title"": null, ""role"": ""reported"", ""organization"": """", ""rank"": 1}], ""organization"": null}, ""type_of_material"": ""News"", ""_id"": ""nyt://article/9a9c4f80-9b13-5995-9f2b-b05633547082"", ""word_count"": 242, ""uri"": ""nyt://article/9a9c4f80-9b13-5995-9f2b-b05633547082""}"
2009-11-17,"{""abstract"": ""Some of the nation\u2019s largest retailers, discount and luxury chains alike, posted better-than-expected earnings."", ""web_url"": ""https://www.nytimes.com/2009/11/18/business/18shop.html"", ""snippet"": ""Some of the nation\u2019s largest retailers, discount and luxury chains alike, posted better-than-expected earnings."", ""lead_paragraph"": ""Some of the nation\u2019s largest retailers, discount and luxury chains alike, posted better- than-expected earnings on Tuesday and said they were seeing signs of broader stabilization. "", ""print_section"": ""B"", ""print_page"": ""9"", ""source"": ""The New York Times"", ""multimedia"": [{""rank"": 0, ""subtype"": ""thumbnail"", ""caption"": null, ""credit"": null, ""type"": ""image"", ""url"": ""images/2009/11/17/business/18shop-ready/thumbStandard.jpg"", ""height"": 75, ""width"": 75, ""subType"": ""thumbnail"", ""crop_name"": ""thumbStandard"", ""legacy"": {""thumbnail"": ""images/2009/11/17/business/18shop-ready/thumbStandard.jpg"", ""thumbnailwidth"": 75, ""thumbnailheight"": 75}}], ""headline"": {""main"": ""Retailer Earnings Show Stabilization"", ""kicker"": null, ""content_kicker"": null, ""print_headline"": ""Retailers\u2019 Earnings Beat Expectations"", ""name"": null, ""seo"": null, ""sub"": null}, ""keywords"": [{""name"": ""subject"", ""value"": ""Shopping and Retail"", ""rank"": 1, ""major"": ""N""}, {""name"": ""subject"", ""value"": ""Company Reports"", ""rank"": 2, ""major"": ""N""}, {""name"": ""organizations"", ""value"": ""Home Depot Inc"", ""rank"": 3, ""major"": ""N""}, {""name"": ""organizations"", ""value"": ""Target Corp"", ""rank"": 4, ""major"": ""N""}, {""name"": ""subject"", ""value"": ""Sales"", ""rank"": 5, ""major"": ""N""}], ""pub_date"": ""2009-11-17T12:12:25+0000"", ""document_type"": ""article"", ""news_desk"": ""Business"", ""section_name"": ""Business Day"", ""byline"": {""original"": ""By Stephanie Rosenbloom"", ""person"": [{""firstname"": ""Stephanie"", ""middlename"": null, ""lastname"": ""Rosenbloom"", ""qualifier"": null, ""title"": null, ""role"": ""reported"", ""organization"": """", ""rank"": 1}], ""organization"": null}, ""type_of_material"": ""News"", ""_id"": ""nyt://article/d3969033-92e6-5ebc-ac5e-6e96bcc05ef8"", ""word_count"": 764, ""uri"": ""nyt://article/d3969033-92e6-5ebc-ac5e-6e96bcc05ef8""}"
2009-11-25,"{""abstract"": ""The Dell Zino (full name Inspiron Zino HD) comes in a box a bit bigger than Apple\u2019s Mac Mini, and adds some cosmetic flavor to the category of compact desktop computers. While the Mini is available in any color as long as it\u2019s white, Zino has a selection of 10 replaceable, colorful lids you can purchase if you change the curtains or the sofa or just get bored with pink."", ""web_url"": ""https://www.nytimes.com/2009/11/26/technology/personaltech/26dell.html"", ""snippet"": ""The Dell Zino (full name Inspiron Zino HD) comes in a box a bit bigger than Apple\u2019s Mac Mini, and adds some cosmetic flavor to the category of compact desktop computers. While the Mini is available in any color as long as it\u2019s white, Zino has a se..."", ""lead_paragraph"": ""The Dell Zino (full name Inspiron Zino HD) comes in a box a bit bigger than Apple\u2019s Mac Mini, and adds some cosmetic flavor to the category of compact desktop computers. While the Mini is available in any color as long as it\u2019s white, Zino has a selection of 10 replaceable, colorful lids you can purchase if you change the curtains or the sofa or just get bored with pink."", ""print_section"": ""B"", ""print_page"": ""5"", ""source"": ""The New York Times"", ""multimedia"": [{""rank"": 0, ""subtype"": ""thumbnail"", ""caption"": null, ""credit"": null, ""type"": ""image"", ""url"": ""images/2009/11/16/technology/personaltech/gadget-dellzino/thumbStandard.jpg"", ""height"": 75, ""width"": 75, ""subType"": ""thumbnail"", ""crop_name"": ""thumbStandard"", ""legacy"": {""thumbnail"": ""images/2009/11/16/technology/personaltech/gadget-dellzino/thumbStandard.jpg"", ""thumbnailwidth"": 75, ""thumbnailheight"": 75}}], ""headline"": {""main"": ""Dell\u2019s Zino May Be Square, but It Doesn\u2019t Lack for Color"", ""kicker"": null, ""content_kicker"": null, ""print_headline"": ""Dell\u2019s Zino May Be Square, but It Doesn\u2019t Lack for Color"", ""name"": null, ""seo"": null, ""sub"": null}, ""keywords"": [], ""pub_date"": ""2009-11-25T21:13:10+0000"", ""document_type"": ""article"", ""news_desk"": ""Business"", ""section_name"": ""Technology"", ""subsection_name"": ""Personal Tech"", ""byline"": {""original"": ""By Stephen Williams"", ""person"": [{""firstname"": ""Stephen"", ""middlename"": null, ""lastname"": ""Williams"", ""qualifier"": null, ""title"": null, ""role"": ""reported"", ""organization"": """", ""rank"": 1}], ""organization"": null}, ""type_of_material"": ""News"", ""_id"": ""nyt://article/07e8ac57-4fd1-5d62-8408-552cc30f4781"", ""word_count"": 173, ""uri"": ""nyt://article/07e8ac57-4fd1-5d62-8408-552cc30f4781""}"
2009-12-01,"{""abstract"": ""Another View: Bill George, a Harvard business professor and the author of \u201c7 Lessons for Leading in Crisis,\u201d puts forth some proposals to revive employment growth in a declining job market."", ""web_url"": ""https://dealbook.nytimes.com/2009/12/01/another-view-spur-innovation-to-unlock-job-growth/"", ""snippet"": ""Another View: Bill George, a Harvard business professor and the author of \u201c7 Lessons for Leading in Crisis,\u201d puts forth some proposals to revive employment growth in a declining job market."", ""lead_paragraph"": ""Bill George, a Harvard business professor and the author of \u201c7 Lessons for Leading in Crisis,\u201d puts forth some proposals to revive employment growth in a declining job market."", ""source"": ""The New York Times"", ""multimedia"": [], ""headline"": {""main"": ""Another View: Innovation Can Unlock Job Growth"", ""kicker"": ""DealBook"", ""content_kicker"": null, ""print_headline"": """", ""name"": null, ""seo"": null, ""sub"": null}, ""keywords"": [{""name"": ""organizations"", ""value"": ""AMAZON.COM INC"", ""rank"": 1, ""major"": ""N""}, {""name"": ""organizations"", ""value"": ""AMGEN INC"", ""rank"": 2, ""major"": ""N""}, {""name"": ""organizations"", ""value"": ""Apple Inc"", ""rank"": 3, ""major"": ""N""}, {""name"": ""organizations"", ""value"": ""Cisco Systems Inc"", ""rank"": 4, ""major"": ""N""}, {""name"": ""organizations"", ""value"": ""Dell Inc"", ""rank"": 5, ""major"": ""N""}, {""name"": ""organizations"", ""value"": ""Genetech Inc"", ""rank"": 6, ""major"": ""N""}, {""name"": ""organizations"", ""value"": ""Google Inc"", ""rank"": 7, ""major"": ""N""}, {""name"": ""organizations"", ""value"": ""Harvard Business School"", ""rank"": 8, ""major"": ""N""}, {""name"": ""organizations"", ""value"": ""Home Depot Inc"", ""rank"": 9, ""major"": ""N""}, {""name"": ""organizations"", ""value"": ""Intel Corp"", ""rank"": 10, ""major"": ""N""}, {""name"": ""organizations"", ""value"": ""Medtronic Inc"", ""rank"": 11, ""major"": ""N""}, {""name"": ""organizations"", ""value"": ""Microsoft Corp"", ""rank"": 12, ""major"": ""N""}, {""name"": ""organizations"", ""value"": ""Oracle Corp"", ""rank"": 13, ""major"": ""N""}, {""name"": ""organizations"", ""value"": ""Starbucks Corp"", ""rank"": 14, ""major"": ""N""}, {""name"": ""organizations"", ""value"": ""Wal-Mart Stores Inc"", ""rank"": 15, ""major"": ""N""}], ""pub_date"": ""2009-12-01T14:01:27+0000"", ""document_type"": ""article"", ""news_desk"": ""Business"", ""section_name"": ""Business Day"", ""byline"": {""original"": ""By Dealbook"", ""person"": [{""firstname"": ""Dealbook"", ""middlename"": null, ""lastname"": """", ""qualifier"": null, ""title"": null, ""role"": ""reported"", ""organization"": """", ""rank"": 1}], ""organization"": null}, ""type_of_material"": """", ""_id"": ""nyt://article/30b753f7-b233-5505-bfcf-770f83364eff"", ""word_count"": 878, ""uri"": ""nyt://article/30b753f7-b233-5505-bfcf-770f83364eff""}"
2009-12-09,"{""abstract"": ""Olive\u2019s 4HD Hifi Music Server, a $2,000 two-terabyte hard drive, delivers audio in studio quality, which can be hard to find."", ""web_url"": ""https://www.nytimes.com/2009/12/10/technology/personaltech/10olive.html"", ""snippet"": ""Olive\u2019s 4HD Hifi Music Server, a $2,000 two-terabyte hard drive, delivers audio in studio quality, which can be hard to find."", ""lead_paragraph"": ""Audiophiles know that the quality of the sound from CD recordings leaves much to be desired. To hear the gold standard of recordings, Olive has created its 4HD Hifi Music Server, a $2,000 two-terabyte hard drive that stores and delivers audio in studio quality, 24-bit/192kHz oversampling format."", ""print_section"": ""B"", ""print_page"": ""5"", ""source"": ""The New York Times"", ""multimedia"": [{""rank"": 0, ""subtype"": ""thumbnail"", ""caption"": null, ""credit"": null, ""type"": ""image"", ""url"": ""images/2009/12/08/technology/gadget-olive4hd/thumbStandard.jpg"", ""height"": 75, ""width"": 75, ""subType"": ""thumbnail"", ""crop_name"": ""thumbStandard"", ""legacy"": {""thumbnail"": ""images/2009/12/08/technology/gadget-olive4hd/thumbStandard.jpg"", ""thumbnailwidth"": 75, ""thumbnailheight"": 75}}], ""headline"": {""main"": ""A Server for the Most Demanding of Music Lovers"", ""kicker"": null, ""content_kicker"": null, ""print_headline"": ""A Server for the Most Demanding of Music Lovers"", ""name"": null, ""seo"": null, ""sub"": null}, ""keywords"": [], ""pub_date"": ""2009-12-09T23:27:02+0000"", ""document_type"": ""article"", ""news_desk"": ""Business"", ""section_name"": ""Technology"", ""subsection_name"": ""Personal Tech"", ""byline"": {""original"": ""By Eric A. Taub"", ""person"": [{""firstname"": ""Eric"", ""middlename"": ""A."", ""lastname"": ""Taub"", ""qualifier"": null, ""title"": null, ""role"": ""reported"", ""organization"": """", ""rank"": 1}], ""organization"": null}, ""type_of_material"": ""News"", ""_id"": ""nyt://article/81de3bd9-2c7f-569c-9ebd-ad9d1bd9b1d0"", ""word_count"": 180, ""uri"": ""nyt://article/81de3bd9-2c7f-569c-9ebd-ad9d1bd9b1d0""}"
2009-12-15,"{""abstract"": ""President Obama told a business audience at a Home Depot in northern Virginia that energy efficiency was a \u201cwin-win\u201d because it would save energy, help the environment and create jobs."", ""web_url"": ""https://green.blogs.nytimes.com/2009/12/15/obama-touts-insulation-as-sexy/"", ""snippet"": ""President Obama told a business audience at a Home Depot in northern Virginia that energy efficiency was a \u201cwin-win\u201d because it would save energy, help the environment and create jobs."", ""lead_paragraph"": ""Promoting one of his favorite themes \u2014 weatherization \u2014 President Obama told a business audience at a Home Depot in northern Virginia on Tuesday that energy efficiency was a \u201cwin-win,\u201d because it would save energy, help the environment and also create jobs."", ""source"": ""The New York Times"", ""multimedia"": [], ""headline"": {""main"": ""Obama Promotes Insulation as \u2018Sexy\u2019"", ""kicker"": ""Green"", ""content_kicker"": null, ""print_headline"": """", ""name"": null, ""seo"": null, ""sub"": null}, ""keywords"": [{""name"": ""subject"", ""value"": ""Energy Efficiency"", ""rank"": 1, ""major"": ""N""}, {""name"": ""persons"", ""value"": ""Obama, Barack"", ""rank"": 2, ""major"": ""N""}, {""name"": ""organizations"", ""value"": ""Home Depot Inc"", ""rank"": 3, ""major"": ""N""}], ""pub_date"": ""2009-12-15T17:28:05+0000"", ""document_type"": ""article"", ""news_desk"": """", ""section_name"": ""Business Day"", ""subsection_name"": ""Energy & Environment "", ""byline"": {""original"": ""By Kate Galbraith"", ""person"": [{""firstname"": ""Kate"", ""middlename"": null, ""lastname"": ""Galbraith"", ""qualifier"": null, ""title"": null, ""role"": ""reported"", ""organization"": """", ""rank"": 1}], ""organization"": null}, ""type_of_material"": """", ""_id"": ""nyt://article/f525f2cd-ffc7-5b94-ab81-67be24397375"", ""word_count"": 235, ""uri"": ""nyt://article/f525f2cd-ffc7-5b94-ab81-67be24397375""}"
2009-12-29,"{""abstract"": ""Despite the effects of the recession, a passion for art among owners of major buildings keeps fresh work in the lobbies."", ""web_url"": ""https://www.nytimes.com/2009/12/30/realestate/30art.html"", ""snippet"": ""Despite the effects of the recession, a passion for art among owners of major buildings keeps fresh work in the lobbies."", ""lead_paragraph"": ""The practice of adorning New York real estate with major sculptures and other artwork stretches back at least as far as the 1930s. And even during today\u2019s tough economic times, the tradition is holding up. A number of major works of art have been installed in Midtown Manhattan in the last few months. "", ""print_section"": ""B"", ""print_page"": ""5"", ""source"": ""The New York Times"", ""multimedia"": [{""rank"": 0, ""subtype"": ""xlarge"", ""caption"": null, ""credit"": null, ""type"": ""image"", ""url"": ""images/2009/12/30/realestate/commercial/30art1/articleLarge.jpg"", ""height"": 350, ""width"": 600, ""subType"": ""xlarge"", ""crop_name"": ""articleLarge"", ""legacy"": {""xlarge"": ""images/2009/12/30/realestate/commercial/30art1/articleLarge.jpg"", ""xlargewidth"": 600, ""xlargeheight"": 350}}, {""rank"": 0, ""subtype"": ""thumbnail"", ""caption"": null, ""credit"": null, ""type"": ""image"", ""url"": ""images/2009/12/30/realestate/commercial/30art1/thumbStandard.jpg"", ""height"": 75, ""width"": 75, ""subType"": ""thumbnail"", ""crop_name"": ""thumbStandard"", ""legacy"": {""thumbnail"": ""images/2009/12/30/realestate/commercial/30art1/thumbStandard.jpg"", ""thumbnailwidth"": 75, ""thumbnailheight"": 75}}], ""headline"": {""main"": ""In the Loftiest of Buildings, High Art Still Finds a Home"", ""kicker"": ""Square Feet"", ""content_kicker"": null, ""print_headline"": ""In the Loftiest of Buildings, High Art Still Finds a Home"", ""name"": null, ""seo"": null, ""sub"": null}, ""keywords"": [], ""pub_date"": ""2009-12-29T19:46:58+0000"", ""document_type"": ""article"", ""news_desk"": ""Business"", ""section_name"": ""Real Estate"", ""byline"": {""original"": ""By Jane L. Levere"", ""person"": [{""firstname"": ""Jane"", ""middlename"": ""L."", ""lastname"": ""Levere"", ""qualifier"": null, ""title"": null, ""role"": ""reported"", ""organization"": """", ""rank"": 1}], ""organization"": null}, ""type_of_material"": ""News"", ""_id"": ""nyt://article/a0d8bf9f-f72f-5543-9453-9880373c5e03"", ""word_count"": 1244, ""uri"": ""nyt://article/a0d8bf9f-f72f-5543-9453-9880373c5e03""}"
2010-01-07,"{""abstract"": ""Another View: Jeffrey Sonnenfeld, a Yale business professor, looks at a rare admission of responsibility for failure, despite a culture that seems to celebrate passing the buck."", ""web_url"": ""https://dealbook.nytimes.com/2010/01/07/another-view-whos-sorry-now/"", ""snippet"": ""Another View: Jeffrey Sonnenfeld, a Yale business professor, looks at a rare admission of responsibility for failure, despite a culture that seems to celebrate passing the buck."", ""lead_paragraph"": ""Jeffrey Sonnenfeld, a Yale business professor, looks at a rare admission of responsibility for failure, despite a culture that seems to celebrate passing the buck."", ""source"": ""The New York Times"", ""multimedia"": [], ""headline"": {""main"": ""Another View: Who\u2019s Sorry Now?"", ""kicker"": ""DealBook"", ""content_kicker"": null, ""print_headline"": """", ""name"": null, ""seo"": null, ""sub"": null}, ""keywords"": [{""name"": ""subject"", ""value"": ""Appointments and Executive Changes"", ""rank"": 1, ""major"": ""N""}, {""name"": ""subject"", ""value"": ""Boards of Directors"", ""rank"": 2, ""major"": ""N""}, {""name"": ""subject"", ""value"": ""Mergers, Acquisitions and Divestitures"", ""rank"": 3, ""major"": ""N""}, {""name"": ""persons"", ""value"": ""Barofsky, Neil M"", ""rank"": 4, ""major"": ""N""}, {""name"": ""persons"", ""value"": ""Bernanke, Ben S"", ""rank"": 5, ""major"": ""N""}, {""name"": ""persons"", ""value"": ""Blankfein, Lloyd C"", ""rank"": 6, ""major"": ""N""}, {""name"": ""persons"", ""value"": ""Dimon, James"", ""rank"": 7, ""major"": ""N""}, {""name"": ""persons"", ""value"": ""Dodd, Christopher J"", ""rank"": 8, ""major"": ""N""}, {""name"": ""persons"", ""value"": ""Fiorina, Carleton S"", ""rank"": 9, ""major"": ""N""}, {""name"": ""persons"", ""value"": ""Francis, Connie"", ""rank"": 10, ""major"": ""N""}, {""name"": ""persons"", ""value"": ""Geithner, Timothy F"", ""rank"": 11, ""major"": ""N""}, {""name"": ""persons"", ""value"": ""Greenspan, Alan"", ""rank"": 12, ""major"": ""N""}, {""name"": ""persons"", ""value"": ""Lady Gaga"", ""rank"": 13, ""major"": ""N""}, {""name"": ""persons"", ""value"": ""Lewis, Kenneth D"", ""rank"": 14, ""major"": ""N""}, {""name"": ""persons"", ""value"": ""Mack, John J"", ""rank"": 15, ""major"": ""N""}, {""name"": ""persons"", ""value"": ""Napolitano, Janet"", ""rank"": 16, ""major"": ""N""}, {""name"": ""persons"", ""value"": ""Obama, Barack"", ""rank"": 17, ""major"": ""N""}, {""name"": ""persons"", ""value"": ""Paulson, Henry M Jr"", ""rank"": 18, ""major"": ""N""}, {""name"": ""persons"", ""value"": ""Rumsfeld, Donald H"", ""rank"": 19, ""major"": ""N""}, {""name"": ""persons"", ""value"": ""Wagoner, G Richard Jr"", ""rank"": 20, ""major"": ""N""}, {""name"": ""persons"", ""value"": ""Waters, Maxine"", ""rank"": 21, ""major"": ""N""}, {""name"": ""organizations"", ""value"": ""AMERICAN INTERNATIONAL GROUP"", ""rank"": 22, ""major"": ""N""}, {""name"": ""organizations"", ""value"": ""AOL"", ""rank"": 23, ""major"": ""N""}, {""name"": ""organizations"", ""value"": ""Bank of America Corp"", ""rank"": 24, ""major"": ""N""}, {""name"": ""organizations"", ""value"": ""Bear Stearns Cos"", ""rank"": 25, ""major"": ""N""}, {""name"": ""organizations"", ""value"": ""Chrysler LLC"", ""rank"": 26, ""major"": ""N""}, {""name"": ""organizations"", ""value"": ""Citigroup Inc"", ""rank"": 27, ""major"": ""N""}, {""name"": ""organizations"", ""value"": ""General Motors"", ""rank"": 28, ""major"": ""N""}, {""name"": ""organizations"", ""value"": ""Goldman Sachs Group"", ""rank"": 29, ""major"": ""N""}, {""name"": ""organizations"", ""value"": ""Hewlett-Packard Co"", ""rank"": 30, ""major"": ""N""}, {""name"": ""organizations"", ""value"": ""Home Depot Inc"", ""rank"": 31, ""major"": ""N""}, {""name"": ""organizations"", ""value"": ""International Business Machines Corporation"", ""rank"": 32, ""major"": ""N""}, {""name"": ""organizations"", ""value"": ""Lehman Brothers Holdings Inc"", ""rank"": 33, ""major"": ""N""}, {""name"": ""organizations"", ""value"": ""Merrill Lynch & Co"", ""rank"": 34, ""major"": ""N""}, {""name"": ""organizations"", ""value"": ""Morgan Stanley"", ""rank"": 35, ""major"": ""N""}, {""name"": ""organizations"", ""value"": ""Time Warner Inc"", ""rank"": 36, ""major"": ""N""}], ""pub_date"": ""2010-01-07T14:05:40+0000"", ""document_type"": ""article"", ""news_desk"": ""Business"", ""section_name"": ""Business Day"", ""byline"": {""original"": ""By Dealbook"", ""person"": [{""firstname"": ""Dealbook"", ""middlename"": null, ""lastname"": """", ""qualifier"": null, ""title"": null, ""role"": ""reported"", ""organization"": """", ""rank"": 1}], ""organization"": null}, ""type_of_material"": """", ""_id"": ""nyt://article/6326c909-19d7-53fb-a300-224dcca79e33"", ""word_count"": 1437, ""uri"": ""nyt://article/6326c909-19d7-53fb-a300-224dcca79e33""}"
2010-01-13,"{""abstract"": ""The Tough-3000 is the first of the company\u2019s rugged line to offer HD video capture (720p) and is also the most affordable Tough model at $230."", ""web_url"": ""https://www.nytimes.com/2010/01/14/technology/personaltech/14olympus.html"", ""snippet"": ""The Tough-3000 is the first of the company\u2019s rugged line to offer HD video capture (720p) and is also the most affordable Tough model at $230."", ""lead_paragraph"": ""Olympus unwrapped its Stylus Tough-3000 camera at the Consumer Electronics Show last week. The Tough-3000 is the first of the company\u2019s rugged line to offer HD video capture (720p) and is also the most affordable Tough model at $230. The Stylus Tough-3000 can withstand a five-foot drop, is submersible to 10 feet and works in temperatures as low as 14 degrees. These are basically the same specs as the existing $280 Stylus Tough-6000."", ""print_section"": ""B"", ""print_page"": ""12"", ""source"": ""The New York Times"", ""multimedia"": [{""rank"": 0, ""subtype"": ""thumbnail"", ""caption"": null, ""credit"": null, ""type"": ""image"", ""url"": ""images/2010/01/13/technology/personaltech/gadget-olympus/thumbStandard.jpg"", ""height"": 75, ""width"": 75, ""subType"": ""thumbnail"", ""crop_name"": ""thumbStandard"", ""legacy"": {""thumbnail"": ""images/2010/01/13/technology/personaltech/gadget-olympus/thumbStandard.jpg"", ""thumbnailwidth"": 75, ""thumbnailheight"": 75}}], ""headline"": {""main"": ""Rugged, Speedy, Aquatic, Cold-Tolerant. And Not a Seal."", ""kicker"": null, ""content_kicker"": null, ""print_headline"": ""Rugged, Speedy, Aquatic, Cold-Tolerant. And Not a Seal."", ""name"": null, ""seo"": null, ""sub"": null}, ""keywords"": [{""name"": ""organizations"", ""value"": ""Olympus Corp"", ""rank"": 1, ""major"": ""N""}, {""name"": ""subject"", ""value"": ""Cameras"", ""rank"": 2, ""major"": ""N""}, {""name"": ""subject"", ""value"": ""International Consumer Electronics Show"", ""rank"": 3, ""major"": ""N""}], ""pub_date"": ""2010-01-13T20:48:52+0000"", ""document_type"": ""article"", ""news_desk"": ""Business"", ""section_name"": ""Technology"", ""subsection_name"": ""Personal Tech"", ""byline"": {""original"": ""By Rik Fairlie"", ""person"": [{""firstname"": ""Rik"", ""middlename"": null, ""lastname"": ""Fairlie"", ""qualifier"": null, ""title"": null, ""role"": ""reported"", ""organization"": """", ""rank"": 1}], ""organization"": null}, ""type_of_material"": ""News"", ""_id"": ""nyt://article/54ef0d78-3c34-5eb3-8a72-adef11b7abfa"", ""word_count"": 188, ""uri"": ""nyt://article/54ef0d78-3c34-5eb3-8a72-adef11b7abfa""}"
