Date,Articles
2007-08-21,"{""abstract"": ""Paramount and DreamWorks Animation said they would exclusively back the HD DVD format for the release of high-definition movies on disc. "", ""web_url"": ""https://www.nytimes.com/2007/08/21/technology/21disney.html"", ""snippet"": ""Paramount and DreamWorks Animation said they would exclusively back the HD DVD format for the release of high-definition movies on disc. "", ""lead_paragraph"": ""LOS ANGELES, Aug. 20 \u2014 Hollywood\u2019s squabble over which of two technologies will replace standard DVDs reignited Monday with two studios throwing their weight behind one format and several rivals ramping up support for the other."", ""print_section"": ""C"", ""print_page"": ""1"", ""source"": ""The New York Times"", ""multimedia"": [{""rank"": 0, ""subtype"": ""xlarge"", ""caption"": null, ""credit"": null, ""type"": ""image"", ""url"": ""images/2007/08/21/business/21disney-600.jpg"", ""height"": 330, ""width"": 600, ""subType"": ""xlarge"", ""crop_name"": ""articleLarge"", ""legacy"": {""xlarge"": ""images/2007/08/21/business/21disney-600.jpg"", ""xlargewidth"": 600, ""xlargeheight"": 330}}, {""rank"": 0, ""subtype"": ""thumbnail"", ""caption"": null, ""credit"": null, ""type"": ""image"", ""url"": ""images/2007/08/21/business/21disney-75.jpg"", ""height"": 75, ""width"": 75, ""subType"": ""thumbnail"", ""crop_name"": ""thumbStandard"", ""legacy"": {""thumbnail"": ""images/2007/08/21/business/21disney-75.jpg"", ""thumbnailwidth"": 75, ""thumbnailheight"": 75}}], ""headline"": {""main"": ""Two Studios to Support HD DVD Over Rival"", ""kicker"": null, ""content_kicker"": null, ""print_headline"": ""Two Studios To Support HD DVD Over Rival"", ""name"": null, ""seo"": null, ""sub"": null}, ""keywords"": [{""name"": ""subject"", ""value"": ""MOTION PICTURES"", ""rank"": 1, ""major"": ""N""}, {""name"": ""glocations"", ""value"": ""Los Angeles (Calif)"", ""rank"": 2, ""major"": ""N""}, {""name"": ""organizations"", ""value"": ""DREAMWORKS SKG"", ""rank"": 3, ""major"": ""N""}, {""name"": ""subject"", ""value"": ""DVD (DIGITAL VERSATILE DISK)"", ""rank"": 4, ""major"": ""N""}, {""name"": ""organizations"", ""value"": ""Paramount Pictures"", ""rank"": 5, ""major"": ""N""}], ""pub_date"": ""2007-08-21T04:00:00+0000"", ""document_type"": ""article"", ""news_desk"": ""Business"", ""section_name"": ""Technology"", ""byline"": {""original"": ""By Brooks Barnes"", ""person"": [{""firstname"": ""Brooks"", ""middlename"": null, ""lastname"": ""Barnes"", ""qualifier"": null, ""title"": null, ""role"": ""reported"", ""organization"": """", ""rank"": 1}], ""organization"": null}, ""type_of_material"": ""News"", ""_id"": ""nyt://article/35d7c651-923d-5da0-9d5d-5d84189bf276"", ""word_count"": 753, ""uri"": ""nyt://article/35d7c651-923d-5da0-9d5d-5d84189bf276""}"
2007-08-23,"{""abstract"": ""Home Depot\u2018s plans to sell its wholesale supply division to a group of private equity buyers is in doubt because the investment banks involved are reluctant to fund the deal, even at a lower price, The Financial Times reported."", ""web_url"": ""https://dealbook.nytimes.com/2007/08/23/bankers-reluctant-to-fund-home-depot-deal-report-says/"", ""snippet"": """", ""lead_paragraph"": ""Home Depot\u2018s plans to sell its wholesale supply division to a group of private equity buyers is in doubt because the investment banks involved are reluctant to fund the deal, even at a lower price, The Financial Times reported."", ""source"": ""The New York Times"", ""multimedia"": [], ""headline"": {""main"": ""Banks Balk at Funding Home Depot Deal, Report Says"", ""kicker"": ""DealBook"", ""content_kicker"": null, ""print_headline"": """", ""name"": null, ""seo"": null, ""sub"": null}, ""keywords"": [], ""pub_date"": ""2007-08-23T11:58:19+0000"", ""document_type"": ""article"", ""news_desk"": ""Business"", ""section_name"": ""Business Day"", ""byline"": {""original"": ""By Dealbook"", ""person"": [{""firstname"": ""Dealbook"", ""middlename"": null, ""lastname"": """", ""qualifier"": null, ""title"": null, ""role"": ""reported"", ""organization"": """", ""rank"": 1}], ""organization"": null}, ""type_of_material"": ""News"", ""_id"": ""nyt://article/9a6a7958-0b28-5580-b048-367b08572f11"", ""word_count"": 154, ""uri"": ""nyt://article/9a6a7958-0b28-5580-b048-367b08572f11""}"
2007-08-24,"[{""abstract"": ""Home Depot was scrambling last night to save the sale of its wholesale unit to a consortium of private equity firms, lowering its asking price by about $1.2 billion from the original $10.3 billion it agreed upon, people involved in the talks said."", ""web_url"": ""https://www.nytimes.com/2007/08/24/business/24depot1.html"", ""snippet"": ""Home Depot was scrambling last night to save the sale of its wholesale unit to a consortium of private equity firms, lowering its asking price by about $1.2 billion from the original $10.3 billion it agreed upon, people involved in the talks said."", ""lead_paragraph"": ""Home Depot was scrambling last night to save the sale of its wholesale unit to a consortium of private equity firms, lowering its asking price by about $1.2 billion from the original $10.3 billion it agreed upon, people involved in the talks said. "", ""print_section"": ""C"", ""print_page"": ""2"", ""source"": ""The New York Times"", ""multimedia"": [], ""headline"": {""main"": ""Home Depot Said to Cut Price to Try to Save Sale of Unit"", ""kicker"": null, ""content_kicker"": null, ""print_headline"": ""Home Depot Said to Cut Price to Try to Save Sale of Unit"", ""name"": null, ""seo"": null, ""sub"": null}, ""keywords"": [{""name"": ""organizations"", ""value"": ""Home Depot Inc"", ""rank"": 1, ""major"": ""N""}, {""name"": ""subject"", ""value"": ""Sales"", ""rank"": 2, ""major"": ""N""}, {""name"": ""subject"", ""value"": ""Housing"", ""rank"": 3, ""major"": ""N""}, {""name"": ""subject"", ""value"": ""Prices (Fares, Fees and Rates)"", ""rank"": 4, ""major"": ""N""}], ""pub_date"": ""2007-08-24T04:00:00+0000"", ""document_type"": ""article"", ""news_desk"": ""Business"", ""section_name"": ""Business Day"", ""byline"": {""original"": ""By Andrew Ross Sorkin"", ""person"": [{""firstname"": ""Andrew"", ""middlename"": ""Ross"", ""lastname"": ""Sorkin"", ""qualifier"": null, ""title"": null, ""role"": ""reported"", ""organization"": """", ""rank"": 1}], ""organization"": null}, ""type_of_material"": ""News"", ""_id"": ""nyt://article/9c6f94e0-ee29-5f5c-8b75-0c71ecb1e458"", ""word_count"": 650, ""uri"": ""nyt://article/9c6f94e0-ee29-5f5c-8b75-0c71ecb1e458""}, {""abstract"": ""Home Depot was scrambling Thursday night to save the sale of its wholesale unit to a consortium of private equity firms, lowering its asking price by about $1.2 billion from the original $10.3 billion it agreed upon, according to The New York Times."", ""web_url"": ""https://dealbook.nytimes.com/2007/08/24/home-depot-scrambling-to-save-sale-of-unit/"", ""snippet"": """", ""lead_paragraph"": ""Home Depot was scrambling Thursday night to save the sale of its wholesale unit to a consortium of private equity firms, lowering its asking price by about $1.2 billion from the original $10.3 billion it agreed upon, according to The New York Times."", ""source"": ""The New York Times"", ""multimedia"": [], ""headline"": {""main"": ""Home Depot Scrambles to Save Sale of Unit"", ""kicker"": ""DealBook"", ""content_kicker"": null, ""print_headline"": """", ""name"": null, ""seo"": null, ""sub"": null}, ""keywords"": [], ""pub_date"": ""2007-08-24T10:47:29+0000"", ""document_type"": ""article"", ""news_desk"": ""Business"", ""section_name"": ""Business Day"", ""byline"": {""original"": ""By Dealbook"", ""person"": [{""firstname"": ""Dealbook"", ""middlename"": null, ""lastname"": """", ""qualifier"": null, ""title"": null, ""role"": ""reported"", ""organization"": """", ""rank"": 1}], ""organization"": null}, ""type_of_material"": ""News"", ""_id"": ""nyt://article/3024b17b-cf75-566c-861c-eaf17e1f1bd1"", ""word_count"": 654, ""uri"": ""nyt://article/3024b17b-cf75-566c-861c-eaf17e1f1bd1""}, {""abstract"": ""Negotiations over the fate of Home Depot\u2018s professional supply unit are likely to drag on through the weekend as financing of the $10.3 billion deal remains up in the air, people briefed on the matter told DealBook. Bankers and lawyers are expected to keep battling over whether the banks in the deal can withdraw their financing commitments, in what one person told The New York Times was \u201cthe most expensive game of chicken you\u2019ve ever played.\u201d"", ""web_url"": ""https://dealbook.nytimes.com/2007/08/24/a-delay-in-the-home-depot-battle-royale-2/"", ""snippet"": """", ""lead_paragraph"": ""Negotiations over the fate of Home Depot\u2018s professional supply unit are likely to drag on through the weekend as financing of the $10.3 billion deal remains up in the air, people briefed on the matter told DealBook. Bankers and lawyers are expected to keep battling over whether the banks in the deal can withdraw their financing commitments, in what one person told The New York Times was \u201cthe most expensive game of chicken you\u2019ve ever played.\u201d"", ""source"": ""The New York Times"", ""multimedia"": [], ""headline"": {""main"": ""A Delay in the Home Depot Battle Royale"", ""kicker"": ""DealBook"", ""content_kicker"": null, ""print_headline"": """", ""name"": null, ""seo"": null, ""sub"": null}, ""keywords"": [], ""pub_date"": ""2007-08-24T19:45:45+0000"", ""document_type"": ""article"", ""news_desk"": ""Business"", ""section_name"": ""Business Day"", ""byline"": {""original"": ""By Dealbook"", ""person"": [{""firstname"": ""Dealbook"", ""middlename"": null, ""lastname"": """", ""qualifier"": null, ""title"": null, ""role"": ""reported"", ""organization"": """", ""rank"": 1}], ""organization"": null}, ""type_of_material"": ""News"", ""_id"": ""nyt://article/6ca0feb1-27f3-54a3-aa90-f7e1943c978d"", ""word_count"": 412, ""uri"": ""nyt://article/6ca0feb1-27f3-54a3-aa90-f7e1943c978d""}]"
2007-08-25,"{""abstract"": ""While stocks leveled off after the Fed\u2019s rate cut, the woes from the collapse of the subprime mortgage market continued to claim more victims."", ""web_url"": ""https://www.nytimes.com/2007/08/25/business/25five.html"", ""snippet"": ""While stocks leveled off after the Fed\u2019s rate cut, the woes from the collapse of the subprime mortgage market continued to claim more victims."", ""lead_paragraph"": ""THE stock market steadied this week after more than a month of volatility, partly in reaction to the Federal Reserve\u2019s decision on Aug. 17 to encourage banks to borrow directly from the Fed at a lower rate and help ease the credit squeeze that has been rattling the financial system. "", ""print_section"": ""C"", ""print_page"": ""2"", ""source"": ""The New York Times"", ""multimedia"": [{""rank"": 0, ""subtype"": ""xlarge"", ""caption"": null, ""credit"": null, ""type"": ""image"", ""url"": ""images/2007/08/25/business/25five.600.jpg"", ""height"": 280, ""width"": 600, ""subType"": ""xlarge"", ""crop_name"": ""articleLarge"", ""legacy"": {""xlarge"": ""images/2007/08/25/business/25five.600.jpg"", ""xlargewidth"": 600, ""xlargeheight"": 280}}, {""rank"": 0, ""subtype"": ""thumbnail"", ""caption"": null, ""credit"": null, ""type"": ""image"", ""url"": ""images/2007/08/25/business/25five.75.jpg"", ""height"": 75, ""width"": 75, ""subType"": ""thumbnail"", ""crop_name"": ""thumbStandard"", ""legacy"": {""thumbnail"": ""images/2007/08/25/business/25five.75.jpg"", ""thumbnailwidth"": 75, ""thumbnailheight"": 75}}], ""headline"": {""main"": ""Wall Street, Still a Little Wobbly, Steadies Itself"", ""kicker"": ""Five Days"", ""content_kicker"": null, ""print_headline"": ""Wall Street, Still a Little Wobbly, Steadies Itself"", ""name"": null, ""seo"": null, ""sub"": null}, ""keywords"": [{""name"": ""organizations"", ""value"": ""TRIBUNE COMPANY"", ""rank"": 1, ""major"": ""N""}, {""name"": ""organizations"", ""value"": ""Congressional Budget Office"", ""rank"": 2, ""major"": ""N""}, {""name"": ""organizations"", ""value"": ""Bank of America Corp"", ""rank"": 3, ""major"": ""N""}, {""name"": ""organizations"", ""value"": ""Federal Reserve System"", ""rank"": 4, ""major"": ""N""}, {""name"": ""subject"", ""value"": ""Stocks and Bonds"", ""rank"": 5, ""major"": ""N""}, {""name"": ""organizations"", ""value"": ""Home Depot Inc"", ""rank"": 6, ""major"": ""N""}], ""pub_date"": ""2007-08-25T04:00:00+0000"", ""document_type"": ""article"", ""news_desk"": ""Business"", ""section_name"": ""Business Day"", ""byline"": {""original"": """", ""person"": [], ""organization"": null}, ""type_of_material"": ""News"", ""_id"": ""nyt://article/994d7663-348f-5ba3-bc58-f791f01a27eb"", ""word_count"": 781, ""uri"": ""nyt://article/994d7663-348f-5ba3-bc58-f791f01a27eb""}"
2007-08-26,"{""abstract"": ""Home Depot reached a tentative new agreement today to sell its wholesale unit to a consortium of private equity firms for a reduced price of $8.5 billion, according to people involved  in the deal."", ""web_url"": ""https://www.nytimes.com/2007/08/26/business/27cnd-depot.html"", ""snippet"": ""Home Depot reached a tentative new agreement today to sell its wholesale unit to a consortium of private equity firms for a reduced price of $8.5 billion, according to people involved  in the deal."", ""lead_paragraph"": ""In one of the most closely watched deals on Wall Street, Home Depot reached a tentative new agreement today to sell its wholesale unit to a consortium of private equity firms for a reduced price of $8.5 billion, according to people involved in the transaction."", ""source"": ""The New York Times"", ""multimedia"": [], ""headline"": {""main"": ""Home Depot Is Said to Cut Deal\u2019s Price by $1.8 Billion"", ""kicker"": null, ""content_kicker"": null, ""print_headline"": ""Home Depot Is Said to Cut Deal\u2019s Price by $1.8 Billion"", ""name"": null, ""seo"": null, ""sub"": null}, ""keywords"": [{""name"": ""subject"", ""value"": ""Mergers, Acquisitions and Divestitures"", ""rank"": 1, ""major"": ""N""}, {""name"": ""organizations"", ""value"": ""Home Depot Inc"", ""rank"": 2, ""major"": ""N""}, {""name"": ""subject"", ""value"": ""Housing"", ""rank"": 3, ""major"": ""N""}, {""name"": ""subject"", ""value"": ""Sales"", ""rank"": 4, ""major"": ""N""}], ""pub_date"": ""2007-08-26T04:00:00+0000"", ""document_type"": ""article"", ""news_desk"": ""ContinuousNews"", ""section_name"": ""Business Day"", ""byline"": {""original"": ""By Andrew Ross Sorkin and Michael J. de la Merced"", ""person"": [{""firstname"": ""Andrew"", ""middlename"": ""Ross"", ""lastname"": ""Sorkin"", ""qualifier"": null, ""title"": null, ""role"": ""reported"", ""organization"": """", ""rank"": 1}, {""firstname"": ""Michael"", ""middlename"": ""J."", ""lastname"": ""de la Merced"", ""qualifier"": null, ""title"": null, ""role"": ""reported"", ""organization"": """", ""rank"": 2}], ""organization"": null}, ""type_of_material"": ""News"", ""_id"": ""nyt://article/5368b27b-2831-5ac8-86e2-5ae8b5b9caa0"", ""word_count"": 692, ""uri"": ""nyt://article/5368b27b-2831-5ac8-86e2-5ae8b5b9caa0""}"
2007-08-27,"[{""abstract"": ""The company dropped the sale price of its commercial supply business by nearly $2 billion, one of the first big buyouts renegotiated amid the credit squeeze."", ""web_url"": ""https://www.nytimes.com/2007/08/27/business/27depot.html"", ""snippet"": ""The company dropped the sale price of its commercial supply business by nearly $2 billion, one of the first big buyouts renegotiated amid the credit squeeze."", ""lead_paragraph"": ""Home Depot was forced to drop the sale price of its commercial supply business by nearly $2 billion yesterday, according to people involved in the negotiations, one of the first big buyouts to be renegotiated as a result of the recent tightening of credit and problems in the housing market."", ""print_section"": ""A"", ""print_page"": ""1"", ""source"": ""The New York Times"", ""multimedia"": [], ""headline"": {""main"": ""Home Depot Unit Sees Price Drop in Tight Market"", ""kicker"": null, ""content_kicker"": null, ""print_headline"": ""Home Depot Unit Sees Price Plunge In Tight Market"", ""name"": null, ""seo"": null, ""sub"": null}, ""keywords"": [{""name"": ""subject"", ""value"": ""Mergers, Acquisitions and Divestitures"", ""rank"": 1, ""major"": ""N""}, {""name"": ""subject"", ""value"": ""Credit"", ""rank"": 2, ""major"": ""N""}, {""name"": ""subject"", ""value"": ""Banks and Banking"", ""rank"": 3, ""major"": ""N""}, {""name"": ""subject"", ""value"": ""Sales"", ""rank"": 4, ""major"": ""N""}, {""name"": ""organizations"", ""value"": ""Home Depot Inc"", ""rank"": 5, ""major"": ""N""}], ""pub_date"": ""2007-08-27T04:00:00+0000"", ""document_type"": ""article"", ""news_desk"": ""Business"", ""section_name"": ""Business Day"", ""byline"": {""original"": ""By Andrew Ross Sorkin and Michael J. de la Merced"", ""person"": [{""firstname"": ""Andrew"", ""middlename"": ""Ross"", ""lastname"": ""Sorkin"", ""qualifier"": null, ""title"": null, ""role"": ""reported"", ""organization"": """", ""rank"": 1}, {""firstname"": ""Michael"", ""middlename"": ""J."", ""lastname"": ""de la Merced"", ""qualifier"": null, ""title"": null, ""role"": ""reported"", ""organization"": """", ""rank"": 2}], ""organization"": null}, ""type_of_material"": ""News"", ""_id"": ""nyt://article/654bdfa2-c397-52d7-a00f-061d1c974978"", ""word_count"": 1165, ""uri"": ""nyt://article/654bdfa2-c397-52d7-a00f-061d1c974978""}, {""abstract"": ""To save its struggling deal, Home Depot was forced to drop the sale price of its commercial supply business by nearly $2 billion yesterday, according to The New York Times, becoming one of the first big buyouts to be renegotiated as a result of the recent tightening of credit and problems in the housing market."", ""web_url"": ""https://dealbook.nytimes.com/2007/08/27/home-depot-unit-sees-price-plunge-in-a-tight-market/"", ""snippet"": """", ""lead_paragraph"": ""To save its struggling deal, Home Depot was forced to drop the sale price of its commercial supply business by nearly $2 billion yesterday, according to The New York Times, becoming one of the first big buyouts to be renegotiated as a result of the recent tightening of credit and problems in the housing market."", ""source"": ""The New York Times"", ""multimedia"": [], ""headline"": {""main"": ""Price for Home Depot Unit Plunges in a Tight Market"", ""kicker"": ""DealBook"", ""content_kicker"": null, ""print_headline"": """", ""name"": null, ""seo"": null, ""sub"": null}, ""keywords"": [], ""pub_date"": ""2007-08-27T10:55:35+0000"", ""document_type"": ""article"", ""news_desk"": ""Business"", ""section_name"": ""Business Day"", ""byline"": {""original"": ""By Dealbook"", ""person"": [{""firstname"": ""Dealbook"", ""middlename"": null, ""lastname"": """", ""qualifier"": null, ""title"": null, ""role"": ""reported"", ""organization"": """", ""rank"": 1}], ""organization"": null}, ""type_of_material"": ""News"", ""_id"": ""nyt://article/90e6949d-1655-54dd-8959-8e76b1675271"", ""word_count"": 910, ""uri"": ""nyt://article/90e6949d-1655-54dd-8959-8e76b1675271""}, {""abstract"": ""Shares in Home Depot rose 1.9 percent to $35.33 in afternoon trading Monday on news that the sale of the company\u2019s wholesale supply unit, HD Supply, is still on track. The retailing giant agreed to trim the price to $8.5 billion as it prepares to sell the unit to Bain Capital, the Carlyle Group and Clayton Dubilier & Rice."", ""web_url"": ""https://dealbook.nytimes.com/2007/08/27/home-depot-shares-rise-as-deal-is-repriced/"", ""snippet"": """", ""lead_paragraph"": ""Shares in Home Depot rose 1.9 percent to $35.33 in afternoon trading Monday on news that the sale of the company\u2019s wholesale supply unit, HD Supply, is still on track. The retailing giant agreed to trim the price to $8.5 billion as it prepares to sell the unit to Bain Capital, the Carlyle Group and Clayton Dubilier & Rice."", ""source"": ""The New York Times"", ""multimedia"": [], ""headline"": {""main"": ""Home Depot Shares Rise as Deal Is Repriced"", ""kicker"": ""DealBook"", ""content_kicker"": null, ""print_headline"": """", ""name"": null, ""seo"": null, ""sub"": null}, ""keywords"": [], ""pub_date"": ""2007-08-27T14:26:36+0000"", ""document_type"": ""article"", ""news_desk"": ""Business"", ""section_name"": ""Business Day"", ""byline"": {""original"": ""By Dealbook"", ""person"": [{""firstname"": ""Dealbook"", ""middlename"": null, ""lastname"": """", ""qualifier"": null, ""title"": null, ""role"": ""reported"", ""organization"": """", ""rank"": 1}], ""organization"": null}, ""type_of_material"": ""News"", ""_id"": ""nyt://article/7c0568b9-307e-5cc2-b5fd-03ba61a60e0d"", ""word_count"": 242, ""uri"": ""nyt://article/7c0568b9-307e-5cc2-b5fd-03ba61a60e0d""}, {""abstract"": ""Will the drama at HD Supply spawn any sequels?"", ""web_url"": ""https://dealbook.nytimes.com/2007/08/27/home-depot-a-script-for-deal-renegotiations/"", ""snippet"": """", ""lead_paragraph"": ""Will the drama at HD Supply spawn any sequels?"", ""source"": ""The New York Times"", ""multimedia"": [], ""headline"": {""main"": ""Home Depot: A Script for Deal Renegotiations?"", ""kicker"": ""DealBook"", ""content_kicker"": null, ""print_headline"": """", ""name"": null, ""seo"": null, ""sub"": null}, ""keywords"": [], ""pub_date"": ""2007-08-27T18:48:37+0000"", ""document_type"": ""article"", ""news_desk"": ""Business"", ""section_name"": ""Business Day"", ""byline"": {""original"": ""By Dealbook"", ""person"": [{""firstname"": ""Dealbook"", ""middlename"": null, ""lastname"": """", ""qualifier"": null, ""title"": null, ""role"": ""reported"", ""organization"": """", ""rank"": 1}], ""organization"": null}, ""type_of_material"": ""News"", ""_id"": ""nyt://article/f6de8be4-5dc6-5213-802d-3a33d8e46775"", ""word_count"": 860, ""uri"": ""nyt://article/f6de8be4-5dc6-5213-802d-3a33d8e46775""}]"
