Date,Articles
2007-01-02,"{""abstract"": ""The retailer is determined to push energy-saving light bulbs with the help of some unlikely partners."", ""web_url"": ""https://www.nytimes.com/2007/01/02/business/02bulb.html"", ""snippet"": ""The retailer is determined to push energy-saving light bulbs with the help of some unlikely partners."", ""lead_paragraph"": ""As a way to cut energy use, it could not be simpler. Unscrew a light bulb that uses a lot of electricity and replace it with one that uses much less."", ""print_section"": ""A"", ""print_page"": ""1"", ""source"": ""The New York Times"", ""multimedia"": [{""rank"": 0, ""subtype"": ""xlarge"", ""caption"": null, ""credit"": null, ""type"": ""image"", ""url"": ""images/2007/01/01/business/600_bulb_1.jpg"", ""height"": 280, ""width"": 600, ""subType"": ""xlarge"", ""crop_name"": ""articleLarge"", ""legacy"": {""xlarge"": ""images/2007/01/01/business/600_bulb_1.jpg"", ""xlargewidth"": 600, ""xlargeheight"": 280}}, {""rank"": 0, ""subtype"": ""thumbnail"", ""caption"": null, ""credit"": null, ""type"": ""image"", ""url"": ""images/2007/01/01/business/75_bulb.jpg"", ""height"": 75, ""width"": 72, ""subType"": ""thumbnail"", ""crop_name"": ""thumbStandard"", ""legacy"": {""thumbnail"": ""images/2007/01/01/business/75_bulb.jpg"", ""thumbnailwidth"": 72, ""thumbnailheight"": 75}}], ""headline"": {""main"": ""Wal-Mart Puts Some Muscle Behind Power-Sipping Bulbs"", ""kicker"": ""The Energy Challenge"", ""content_kicker"": null, ""print_headline"": ""Wal-Mart Puts Some Muscle Behind Power-Sipping Bulbs"", ""name"": null, ""seo"": null, ""sub"": null}, ""keywords"": [{""name"": ""subject"", ""value"": ""Electric Light Bulbs"", ""rank"": 1, ""major"": ""N""}, {""name"": ""organizations"", ""value"": ""Home Depot Inc"", ""rank"": 2, ""major"": ""N""}, {""name"": ""organizations"", ""value"": ""Wal-Mart Stores Inc"", ""rank"": 3, ""major"": ""N""}, {""name"": ""subject"", ""value"": ""Conservation of Resources"", ""rank"": 4, ""major"": ""N""}, {""name"": ""subject"", ""value"": ""Energy Efficiency"", ""rank"": 5, ""major"": ""N""}], ""pub_date"": ""2007-01-02T05:00:00+0000"", ""document_type"": ""article"", ""news_desk"": ""Business"", ""section_name"": ""Business Day"", ""byline"": {""original"": ""By Michael Barbaro"", ""person"": [{""firstname"": ""Michael"", ""middlename"": null, ""lastname"": ""Barbaro"", ""qualifier"": null, ""title"": null, ""role"": ""reported"", ""organization"": """", ""rank"": 1}], ""organization"": null}, ""type_of_material"": ""News"", ""_id"": ""nyt://article/a6c0bfa4-1e56-542a-ba5a-3ffec764231c"", ""word_count"": 1801, ""uri"": ""nyt://article/a6c0bfa4-1e56-542a-ba5a-3ffec764231c""}"
2007-01-03,"[{""abstract"": ""Robert L. Nardelli was criticized for his pay package and failure to lift the chain\u2019s stagnant stock price."", ""web_url"": ""https://www.nytimes.com/2007/01/03/business/03cnd-depot.html"", ""snippet"": ""Robert L. Nardelli was criticized for his pay package and failure to lift the chain\u2019s stagnant stock price."", ""lead_paragraph"": ""Robert L. Nardelli, the chief executive of Home Depot, who came under heavy criticism for his pay package and failure to lift the chain\u2019s stagnant stock price, has abruptly resigned, the company said today."", ""source"": ""The New York Times"", ""multimedia"": [{""rank"": 0, ""subtype"": ""thumbnail"", ""caption"": null, ""credit"": null, ""type"": ""image"", ""url"": ""images/2007/01/03/business/03home75.jpg"", ""height"": 75, ""width"": 75, ""subType"": ""thumbnail"", ""crop_name"": ""thumbStandard"", ""legacy"": {""thumbnail"": ""images/2007/01/03/business/03home75.jpg"", ""thumbnailwidth"": 75, ""thumbnailheight"": 75}}], ""headline"": {""main"": ""Embattled Chief Executive Resigns at Home Depot"", ""kicker"": null, ""content_kicker"": null, ""print_headline"": """", ""name"": null, ""seo"": null, ""sub"": null}, ""keywords"": [], ""pub_date"": ""2007-01-03T05:00:00+0000"", ""document_type"": ""article"", ""news_desk"": ""ContinuousNews"", ""section_name"": ""Business Day"", ""byline"": {""original"": ""By Michael Barbaro"", ""person"": [{""firstname"": ""Michael"", ""middlename"": null, ""lastname"": ""Barbaro"", ""qualifier"": null, ""title"": null, ""role"": ""reported"", ""organization"": """", ""rank"": 1}], ""organization"": null}, ""type_of_material"": ""News"", ""_id"": ""nyt://article/538380d5-b661-5274-b52e-6ac78eaa2bf9"", ""word_count"": 480, ""uri"": ""nyt://article/538380d5-b661-5274-b52e-6ac78eaa2bf9""}, {""abstract"": "" Home Depot, the giant home-improvement chain, said Wednesday that Robert L. Nardelli resigned as its chairman and chief executive. Mr. Nardelli\u2019s departure, which the company said was part of a mutual agreement, comes amid mounting criticism of Home Depot\u2019s executive compensation practices and its flagging stock price. "", ""web_url"": ""https://dealbook.nytimes.com/2007/01/03/home-depots-nardelli-to-resign/"", ""snippet"": """", ""lead_paragraph"": "" Home Depot, the giant home-improvement chain, said Wednesday that Robert L. Nardelli resigned as its chairman and chief executive. Mr. Nardelli\u2019s departure, which the company said was part of a mutual agreement, comes amid mounting criticism of Home Depot\u2019s executive compensation practices and its flagging stock price. "", ""source"": ""The New York Times"", ""multimedia"": [], ""headline"": {""main"": ""Home Depot\u2019s Chief Resigns as Proxy Fight Looms"", ""kicker"": ""DealBook"", ""content_kicker"": null, ""print_headline"": """", ""name"": null, ""seo"": null, ""sub"": null}, ""keywords"": [], ""pub_date"": ""2007-01-03T13:10:34+0000"", ""document_type"": ""article"", ""news_desk"": ""Business"", ""section_name"": ""Business Day"", ""byline"": {""original"": ""By Dealbook"", ""person"": [{""firstname"": ""Dealbook"", ""middlename"": null, ""lastname"": """", ""qualifier"": null, ""title"": null, ""role"": ""reported"", ""organization"": """", ""rank"": 1}], ""organization"": null}, ""type_of_material"": ""News"", ""_id"": ""nyt://article/1eda35a8-82aa-5972-962d-0602633effa3"", ""word_count"": 766, ""uri"": ""nyt://article/1eda35a8-82aa-5972-962d-0602633effa3""}, {""abstract"": "" When you are carrying $210 million in goodies, it is hard to make a quiet exit. This is especially true when you are Robert Nardelli, whose pay as the chief executive of Home Depot has long been a source of controversy. Hours after his resignation was announced early Wednesday, there were some strong reactions to Mr. Nardelli\u2019s severance package, which the company valued at $210 million. "", ""web_url"": ""https://dealbook.nytimes.com/2007/01/03/a-golden-goodbye-for-home-depot-chief/"", ""snippet"": """", ""lead_paragraph"": "" When you are carrying $210 million in goodies, it is hard to make a quiet exit. This is especially true when you are Robert Nardelli, whose pay as the chief executive of Home Depot has long been a source of controversy. Hours after his resignation was announced early Wednesday, there were some strong reactions to Mr. Nardelli\u2019s severance package, which the company valued at $210 million. "", ""source"": ""The New York Times"", ""multimedia"": [], ""headline"": {""main"": ""A Golden Goodbye for Home Depot Chief"", ""kicker"": ""DealBook"", ""content_kicker"": null, ""print_headline"": """", ""name"": null, ""seo"": null, ""sub"": null}, ""keywords"": [], ""pub_date"": ""2007-01-03T19:22:05+0000"", ""document_type"": ""article"", ""news_desk"": ""Business"", ""section_name"": ""Business Day"", ""byline"": {""original"": ""By Dealbook"", ""person"": [{""firstname"": ""Dealbook"", ""middlename"": null, ""lastname"": """", ""qualifier"": null, ""title"": null, ""role"": ""reported"", ""organization"": """", ""rank"": 1}], ""organization"": null}, ""type_of_material"": ""News"", ""_id"": ""nyt://article/229d1596-1b00-5996-b0cb-8d1c1116acc9"", ""word_count"": 380, ""uri"": ""nyt://article/229d1596-1b00-5996-b0cb-8d1c1116acc9""}]"
2007-01-04,"[{""abstract"": ""The departure of Home Depot\u2019s chief was a victory for shareholders hoping to force corporate directors to be more accountable for executive pay."", ""web_url"": ""https://www.nytimes.com/2007/01/04/business/04place.html"", ""snippet"": ""The departure of Home Depot\u2019s chief was a victory for shareholders hoping to force corporate directors to be more accountable for executive pay."", ""lead_paragraph"": ""Arrogance has never been attractive in a leader. Now, in corporate chief executives anyhow, it may be a career ender."", ""print_section"": ""C"", ""print_page"": ""1"", ""source"": ""The New York Times"", ""multimedia"": [{""rank"": 0, ""subtype"": ""thumbnail"", ""caption"": null, ""credit"": null, ""type"": ""image"", ""url"": ""images/2007/01/04/business/75_pay.jpg"", ""height"": 75, ""width"": 75, ""subType"": ""thumbnail"", ""crop_name"": ""thumbStandard"", ""legacy"": {""thumbnail"": ""images/2007/01/04/business/75_pay.jpg"", ""thumbnailwidth"": 75, ""thumbnailheight"": 75}}], ""headline"": {""main"": ""A Warning Shot by Investors to Boards and Chiefs"", ""kicker"": ""Market Place"", ""content_kicker"": null, ""print_headline"": ""A Warning Shot by Investors to Boards and Chiefs"", ""name"": null, ""seo"": null, ""sub"": null}, ""keywords"": [{""name"": ""persons"", ""value"": ""Nardelli, Robert L"", ""rank"": 1, ""major"": ""N""}, {""name"": ""organizations"", ""value"": ""Home Depot Inc"", ""rank"": 2, ""major"": ""N""}, {""name"": ""subject"", ""value"": ""Executives and Management"", ""rank"": 3, ""major"": ""N""}, {""name"": ""subject"", ""value"": ""Suspensions, Dismissals and Resignations"", ""rank"": 4, ""major"": ""N""}, {""name"": ""subject"", ""value"": ""Wages and Salaries"", ""rank"": 5, ""major"": ""N""}], ""pub_date"": ""2007-01-04T05:00:00+0000"", ""document_type"": ""article"", ""news_desk"": ""Business"", ""section_name"": ""Business Day"", ""byline"": {""original"": ""By Gretchen Morgenson"", ""person"": [{""firstname"": ""Gretchen"", ""middlename"": null, ""lastname"": ""Morgenson"", ""qualifier"": null, ""title"": null, ""role"": ""reported"", ""organization"": """", ""rank"": 1}], ""organization"": null}, ""type_of_material"": ""News"", ""_id"": ""nyt://article/51c7db0a-2fe9-5a5f-bc2a-38cae2f1db79"", ""word_count"": 1199, ""uri"": ""nyt://article/51c7db0a-2fe9-5a5f-bc2a-38cae2f1db79""}, {""abstract"": ""The board decided that Robert L. Nardelli should go \u2014 with a $210 million exit package."", ""web_url"": ""https://www.nytimes.com/2007/01/04/business/04home.html"", ""snippet"": ""The board decided that Robert L. Nardelli should go \u2014 with a $210 million exit package."", ""lead_paragraph"": ""In May, in a nearly empty basement ballroom at the Hotel du Pont in Wilmington, Del., Robert L. Nardelli, the chairman and chief executive of Home Depot, stood between huge timers, intended to limit questions from the handful of shareholders present. After dismissing questions about his compensation or the independence of the board, Mr. Nardelli abruptly ended the meeting after only 30 minutes."", ""print_section"": ""A"", ""print_page"": ""1"", ""source"": ""The New York Times"", ""multimedia"": [{""rank"": 0, ""subtype"": ""thumbnail"", ""caption"": null, ""credit"": null, ""type"": ""image"", ""url"": ""images/2007/01/03/business/04home.75.jpg"", ""height"": 75, ""width"": 75, ""subType"": ""thumbnail"", ""crop_name"": ""thumbStandard"", ""legacy"": {""thumbnail"": ""images/2007/01/03/business/04home.75.jpg"", ""thumbnailwidth"": 75, ""thumbnailheight"": 75}}], ""headline"": {""main"": ""Home Depot Ousts Highly Paid Chief"", ""kicker"": null, ""content_kicker"": null, ""print_headline"": ""Home Depot Board Ousts Chief, Saying Goodbye With Big Check"", ""name"": null, ""seo"": null, ""sub"": null}, ""keywords"": [{""name"": ""subject"", ""value"": ""RETAIL STORES AND TRADE"", ""rank"": 1, ""major"": ""N""}, {""name"": ""subject"", ""value"": ""Appointments and Executive Changes"", ""rank"": 2, ""major"": ""N""}, {""name"": ""persons"", ""value"": ""Nardelli, Robert L"", ""rank"": 3, ""major"": ""N""}, {""name"": ""subject"", ""value"": ""Stocks and Bonds"", ""rank"": 4, ""major"": ""N""}, {""name"": ""subject"", ""value"": ""Sales"", ""rank"": 5, ""major"": ""N""}, {""name"": ""organizations"", ""value"": ""Home Depot Inc"", ""rank"": 6, ""major"": ""N""}, {""name"": ""subject"", ""value"": ""Executives and Management"", ""rank"": 7, ""major"": ""N""}, {""name"": ""subject"", ""value"": ""Suspensions, Dismissals and Resignations"", ""rank"": 8, ""major"": ""N""}], ""pub_date"": ""2007-01-04T05:00:00+0000"", ""document_type"": ""article"", ""news_desk"": ""Business"", ""section_name"": ""Business Day"", ""byline"": {""original"": ""By Julie Creswell and Michael Barbaro"", ""person"": [{""firstname"": ""Julie"", ""middlename"": null, ""lastname"": ""Creswell"", ""qualifier"": null, ""title"": null, ""role"": ""reported"", ""organization"": """", ""rank"": 1}, {""firstname"": ""Michael"", ""middlename"": null, ""lastname"": ""Barbaro"", ""qualifier"": null, ""title"": null, ""role"": ""reported"", ""organization"": """", ""rank"": 2}], ""organization"": null}, ""type_of_material"": ""News"", ""_id"": ""nyt://article/a821b6ac-2bbc-5854-ba59-63e004144437"", ""word_count"": 1818, ""uri"": ""nyt://article/a821b6ac-2bbc-5854-ba59-63e004144437""}, {""abstract"": ""Robert L. Nardelli\u2019s departure illustrates that even when investor voices are heard on executive pay, shareholders often wind up holding the bag."", ""web_url"": ""https://www.nytimes.com/2007/01/04/business/04pay.html"", ""snippet"": ""Robert L. Nardelli\u2019s departure illustrates that even when investor voices are heard on executive pay, shareholders often wind up holding the bag."", ""lead_paragraph"": ""Robert L. Nardelli\u2019s rich compensation and poor performance at Home Depot have long been cited by shareholder activists as a prime example of what they view as excessive executive pay. Some union members dressed up in giant chicken outfits to protest the board\u2019s reluctance to clip Mr. Nardelli\u2019s wings."", ""print_section"": ""C"", ""print_page"": ""4"", ""source"": ""The New York Times"", ""multimedia"": [], ""headline"": {""main"": ""An Ousted Chief\u2019s Going-Away Pay Is Seen by Many as Typically Excessive"", ""kicker"": null, ""content_kicker"": null, ""print_headline"": ""An Ousted Chief\u2019s Going-Away Pay Is Seen by Many as Typically Excessive"", ""name"": null, ""seo"": null, ""sub"": null}, ""keywords"": [{""name"": ""persons"", ""value"": ""Nardelli, Robert L"", ""rank"": 1, ""major"": ""N""}, {""name"": ""organizations"", ""value"": ""Home Depot Inc"", ""rank"": 2, ""major"": ""N""}, {""name"": ""subject"", ""value"": ""Executives and Management"", ""rank"": 3, ""major"": ""N""}, {""name"": ""subject"", ""value"": ""Suspensions, Dismissals and Resignations"", ""rank"": 4, ""major"": ""N""}, {""name"": ""subject"", ""value"": ""Wages and Salaries"", ""rank"": 5, ""major"": ""N""}], ""pub_date"": ""2007-01-04T05:00:00+0000"", ""document_type"": ""article"", ""news_desk"": ""Business"", ""section_name"": ""Business Day"", ""byline"": {""original"": ""By Eric Dash"", ""person"": [{""firstname"": ""Eric"", ""middlename"": null, ""lastname"": ""Dash"", ""qualifier"": null, ""title"": null, ""role"": ""reported"", ""organization"": """", ""rank"": 1}], ""organization"": null}, ""type_of_material"": ""News"", ""_id"": ""nyt://article/ccafc93b-176e-5729-9fba-396b03a24bf5"", ""word_count"": 1078, ""uri"": ""nyt://article/ccafc93b-176e-5729-9fba-396b03a24bf5""}, {""abstract"": ""General Electric has long been seen as a training ground for future C.E.O.\u2019s. The ouster of Robert L. Nardelli, a G.E. alumnus, may change that perception."", ""web_url"": ""https://www.nytimes.com/2007/01/04/business/04electric.html"", ""snippet"": ""General Electric has long been seen as a training ground for future C.E.O.\u2019s. The ouster of Robert L. Nardelli, a G.E. alumnus, may change that perception."", ""lead_paragraph"": ""When boards of directors go shopping for a new chief executive, their first stop is often General Electric."", ""print_section"": ""C"", ""print_page"": ""1"", ""source"": ""The New York Times"", ""multimedia"": [], ""headline"": {""main"": ""G.E. Magic Can Fade, After G.E."", ""kicker"": null, ""content_kicker"": null, ""print_headline"": ""G.E. Magic Can Fade, After G.E."", ""name"": null, ""seo"": null, ""sub"": null}, ""keywords"": [{""name"": ""persons"", ""value"": ""Nardelli, Robert L"", ""rank"": 1, ""major"": ""N""}, {""name"": ""organizations"", ""value"": ""Home Depot Inc"", ""rank"": 2, ""major"": ""N""}, {""name"": ""organizations"", ""value"": ""General Electric Co"", ""rank"": 3, ""major"": ""N""}, {""name"": ""subject"", ""value"": ""Executives and Management"", ""rank"": 4, ""major"": ""N""}, {""name"": ""subject"", ""value"": ""Appointments and Executive Changes"", ""rank"": 5, ""major"": ""N""}], ""pub_date"": ""2007-01-04T05:00:00+0000"", ""document_type"": ""article"", ""news_desk"": ""Business"", ""section_name"": ""Business Day"", ""byline"": {""original"": ""By Claudia H. Deutsch"", ""person"": [{""firstname"": ""Claudia"", ""middlename"": ""H."", ""lastname"": ""Deutsch"", ""qualifier"": null, ""title"": null, ""role"": ""reported"", ""organization"": """", ""rank"": 1}], ""organization"": null}, ""type_of_material"": ""News"", ""_id"": ""nyt://article/d67956fb-e77d-506b-8b4d-892eaf2449d8"", ""word_count"": 1295, ""uri"": ""nyt://article/d67956fb-e77d-506b-8b4d-892eaf2449d8""}, {""abstract"": "" As shareholders, industry watchers and lawmakers continued to express outrage over the $210 million golden farewell that Home Depot awarded its ousted chief executive, Robert L. Nardelli, The New York Times takes a look at where it all began: General Electric, which has become a kind of high-end boutique where company directors go when they are looking for the cream of the crop in chief executives. "", ""web_url"": ""https://dealbook.nytimes.com/2007/01/04/home-depot-shake-up-puts-ge-martin-lipton-in-the-spotlight/"", ""snippet"": """", ""lead_paragraph"": "" As shareholders, industry watchers and lawmakers continued to express outrage over the $210 million golden farewell that Home Depot awarded its ousted chief executive, Robert L. Nardelli, The New York Times takes a look at where it all began: General Electric, which has become a kind of high-end boutique where company directors go when they are looking for the cream of the crop in chief executives. "", ""source"": ""The New York Times"", ""multimedia"": [], ""headline"": {""main"": ""Home Depot Moves Put G.E., Martin Lipton in Spotlight"", ""kicker"": ""DealBook"", ""content_kicker"": null, ""print_headline"": """", ""name"": null, ""seo"": null, ""sub"": null}, ""keywords"": [], ""pub_date"": ""2007-01-04T12:36:57+0000"", ""document_type"": ""article"", ""news_desk"": ""Business"", ""section_name"": ""Business Day"", ""byline"": {""original"": ""By Dealbook"", ""person"": [{""firstname"": ""Dealbook"", ""middlename"": null, ""lastname"": """", ""qualifier"": null, ""title"": null, ""role"": ""reported"", ""organization"": """", ""rank"": 1}], ""organization"": null}, ""type_of_material"": ""News"", ""_id"": ""nyt://article/673770a3-c0c8-52f2-a9ce-b08454655102"", ""word_count"": 670, ""uri"": ""nyt://article/673770a3-c0c8-52f2-a9ce-b08454655102""}, {""abstract"": ""Bob Nardelli could not see the value of good pay \u2014 at least for others."", ""web_url"": ""https://economix.blogs.nytimes.com/2007/01/04/nardellis-departure/"", ""snippet"": ""Bob Nardelli could not see the value of good pay \u2014 at least for others."", ""lead_paragraph"": ""There is a wonderful irony to the departure of Bob Nardelli from Home Depot."", ""source"": ""The New York Times"", ""multimedia"": [], ""headline"": {""main"": ""Nardelli\u2019s Departure"", ""kicker"": ""Economix"", ""content_kicker"": null, ""print_headline"": """", ""name"": null, ""seo"": null, ""sub"": null}, ""keywords"": [], ""pub_date"": ""2007-01-04T19:11:03+0000"", ""document_type"": ""article"", ""news_desk"": ""Business"", ""section_name"": ""Business Day"", ""subsection_name"": ""Economy"", ""byline"": {""original"": ""By Floyd Norris"", ""person"": [{""firstname"": ""Floyd"", ""middlename"": null, ""lastname"": ""Norris"", ""qualifier"": null, ""title"": null, ""role"": ""reported"", ""organization"": """", ""rank"": 1}], ""organization"": null}, ""type_of_material"": ""News"", ""_id"": ""nyt://article/e9e14a6d-a003-5538-bd0c-38de6d167928"", ""word_count"": 96, ""uri"": ""nyt://article/e9e14a6d-a003-5538-bd0c-38de6d167928""}]"
