Date,Articles
2012-10-01,"{""abstract"": ""Ceradyne shareholders will receive $35 a share in cash through a tender offer that is expected to begin within the next two weeks, a 43 percent premium to the ceramics maker\u2019s closing price on Friday."", ""web_url"": ""https://dealbook.nytimes.com/2012/10/01/3m-to-buy-ceradyne-for-860-million/"", ""snippet"": ""Ceradyne shareholders will receive $35 a share in cash through a tender offer that is expected to begin within the next two weeks, a 43 percent premium to the ceramics maker\u2019s closing price on Friday."", ""lead_paragraph"": ""The 3M Company said on Monday that it planned to buy Ceradyne, a ceramics maker, for $860 million in cash, in the manufacturer\u2019s biggest deal in two years."", ""source"": ""The New York Times"", ""multimedia"": [], ""headline"": {""main"": ""3M to Buy Ceradyne for $860 Million"", ""kicker"": ""DealBook"", ""content_kicker"": null, ""print_headline"": """", ""name"": null, ""seo"": null, ""sub"": null}, ""keywords"": [{""name"": ""subject"", ""value"": ""Mergers, Acquisitions and Divestitures"", ""rank"": 2, ""major"": ""N""}, {""name"": ""organizations"", ""value"": ""3M Company"", ""rank"": 3, ""major"": ""N""}, {""name"": ""organizations"", ""value"": ""Ceradyne Inc"", ""rank"": 4, ""major"": ""N""}], ""pub_date"": ""2012-10-01T13:09:41+0000"", ""document_type"": ""article"", ""news_desk"": """", ""section_name"": ""Business Day"", ""byline"": {""original"": ""By Michael J. de la Merced"", ""person"": [{""firstname"": ""Michael"", ""middlename"": ""J."", ""lastname"": ""de la Merced"", ""qualifier"": null, ""title"": null, ""role"": ""reported"", ""organization"": """", ""rank"": 1}], ""organization"": null}, ""type_of_material"": ""News"", ""_id"": ""nyt://article/78606490-68ab-58a4-80c6-b3a910b42e66"", ""word_count"": 217, ""uri"": ""nyt://article/78606490-68ab-58a4-80c6-b3a910b42e66""}"
2012-10-03,"{""abstract"": ""A month after the Justice Department had threatened to sue block the deal, 3M announced on Wednesday that it was terminating its agreement with Avery Dennison to buy its office and consumer products business for $550 million in cash."", ""web_url"": ""https://dealbook.nytimes.com/2012/10/03/3m-abandons-deal-to-buy-avery-dennison-unit/"", ""snippet"": ""A month after the Justice Department had threatened to sue block the deal, 3M announced on Wednesday that it was terminating its agreement with Avery Dennison to buy its office and consumer products business for $550 million in cash."", ""lead_paragraph"": ""A month after the Justice Department had threatened to sue block the deal, 3M announced on Wednesday that it was terminating its agreement with Avery Dennison to buy its office and consumer products business for $550 million in cash. "", ""source"": ""The New York Times"", ""multimedia"": [], ""headline"": {""main"": ""3M Abandons Deal to Buy Avery Dennison Unit"", ""kicker"": ""DealBook"", ""content_kicker"": null, ""print_headline"": """", ""name"": null, ""seo"": null, ""sub"": null}, ""keywords"": [{""name"": ""subject"", ""value"": ""Antitrust Laws and Competition Issues"", ""rank"": 2, ""major"": ""N""}, {""name"": ""subject"", ""value"": ""Mergers, Acquisitions and Divestitures"", ""rank"": 3, ""major"": ""N""}, {""name"": ""organizations"", ""value"": ""3M Company"", ""rank"": 4, ""major"": ""N""}, {""name"": ""organizations"", ""value"": ""Avery Dennison Corporation"", ""rank"": 5, ""major"": ""N""}, {""name"": ""organizations"", ""value"": ""Justice Department"", ""rank"": 6, ""major"": ""N""}], ""pub_date"": ""2012-10-03T21:40:08+0000"", ""document_type"": ""article"", ""news_desk"": """", ""section_name"": ""Business Day"", ""byline"": {""original"": ""By Dealbook"", ""person"": [{""firstname"": ""Dealbook"", ""middlename"": null, ""lastname"": """", ""qualifier"": null, ""title"": null, ""role"": ""reported"", ""organization"": """", ""rank"": 1}], ""organization"": null}, ""type_of_material"": ""News"", ""_id"": ""nyt://article/3d4310ec-e20c-521b-9b6c-15ab54a08f18"", ""word_count"": 304, ""uri"": ""nyt://article/3d4310ec-e20c-521b-9b6c-15ab54a08f18""}"
2012-10-21,"{""abstract"": ""Governments reports will include third-quarter gross domestic product and new home sales for September, and companies reporting earnings will include Caterpillar, Facebook, 3M, AT&T and Apple."", ""web_url"": ""https://www.nytimes.com/2012/10/22/business/economy/economic-reports-for-the-week-of-oct-22.html"", ""snippet"": ""Governments reports will include third-quarter gross domestic product and new home sales for September, and companies reporting earnings will include Caterpillar, Facebook, 3M, AT&T and Apple."", ""lead_paragraph"": "" ECONOMIC REPORTS Data to be released will include new home sales for September (Wednesday); weekly jobless claims, durable goods for September and pending home sales for September (Thursday); and third-quarter gross domestic product and the Thomson Reuters/University of Michigan consumer sentiment index for October (Friday)."", ""print_section"": ""B"", ""print_page"": ""2"", ""source"": ""The New York Times"", ""multimedia"": [], ""headline"": {""main"": ""Economic Reports for the Week Ahead"", ""kicker"": ""Looking Ahead"", ""content_kicker"": null, ""print_headline"": ""Economic Reports for the Week Ahead"", ""name"": null, ""seo"": null, ""sub"": null}, ""keywords"": [{""name"": ""subject"", ""value"": ""United States Economy"", ""rank"": 1, ""major"": ""N""}, {""name"": ""subject"", ""value"": ""Economic Conditions and Trends"", ""rank"": 2, ""major"": ""N""}, {""name"": ""subject"", ""value"": ""Company Reports"", ""rank"": 3, ""major"": ""N""}, {""name"": ""subject"", ""value"": ""European Sovereign Debt Crisis (2010- )"", ""rank"": 4, ""major"": ""N""}], ""pub_date"": ""2012-10-21T21:56:36+0000"", ""document_type"": ""article"", ""news_desk"": ""Business"", ""section_name"": ""Business Day"", ""subsection_name"": ""Economy"", ""byline"": {""original"": """", ""person"": [], ""organization"": null}, ""type_of_material"": ""Schedule"", ""_id"": ""nyt://article/80afb517-adb1-52ab-9cfa-60a95767b1b0"", ""word_count"": 300, ""uri"": ""nyt://article/80afb517-adb1-52ab-9cfa-60a95767b1b0""}"
2012-10-22,"{""abstract"": ""The stagnation of wages in recent years has many causes, but reflects a failure to invest enough in the skills and productivity of the American work force, two economists write."", ""web_url"": ""https://economix.blogs.nytimes.com/2012/10/22/the-uncomfortable-truth-about-american-wages/"", ""snippet"": ""The stagnation of wages in recent years has many causes, but reflects a failure to invest enough in the skills and productivity of the American work force, two economists write."", ""lead_paragraph"": ""Michael Greenstone is director of the Hamilton Project and a senior fellow at the Brookings Institution. He is also the 3M Professor of Environmental Economics at M.I.T. Adam Looney is policy director of the Hamilton Project and a senior fellow at Brookings."", ""source"": ""The New York Times"", ""multimedia"": [], ""headline"": {""main"": ""The Uncomfortable Truth About American Wages"", ""kicker"": ""Economix"", ""content_kicker"": null, ""print_headline"": """", ""name"": null, ""seo"": null, ""sub"": null}, ""keywords"": [{""name"": ""subject"", ""value"": ""Labor and Jobs"", ""rank"": 1, ""major"": ""N""}, {""name"": ""subject"", ""value"": ""United States Economy"", ""rank"": 2, ""major"": ""N""}, {""name"": ""subject"", ""value"": ""Wages and Salaries"", ""rank"": 3, ""major"": ""N""}], ""pub_date"": ""2012-10-22T17:00:29+0000"", ""document_type"": ""article"", ""news_desk"": """", ""section_name"": ""Business Day"", ""subsection_name"": ""Economy"", ""byline"": {""original"": ""By Michael Greenstone and Adam Looney"", ""person"": [{""firstname"": ""Michael"", ""middlename"": null, ""lastname"": ""Greenstone"", ""qualifier"": null, ""title"": null, ""role"": ""reported"", ""organization"": """", ""rank"": 1}, {""firstname"": ""Adam"", ""middlename"": null, ""lastname"": ""Looney"", ""qualifier"": null, ""title"": null, ""role"": ""reported"", ""organization"": """", ""rank"": 2}], ""organization"": null}, ""type_of_material"": ""News"", ""_id"": ""nyt://article/f3f8d154-97ac-5324-85d8-f94f67ef8865"", ""word_count"": 729, ""uri"": ""nyt://article/f3f8d154-97ac-5324-85d8-f94f67ef8865""}"
2013-01-28,"{""abstract"": ""Spots for Post-it notes present them as a vehicle for self-expression by depicting the unusual and unexpected ways that consumers use the notes."", ""web_url"": ""https://www.nytimes.com/2013/01/28/business/mutfund/3m-says-go-ahead-make-something-of-it.html"", ""snippet"": ""Spots for Post-it notes present them as a vehicle for self-expression by depicting the unusual and unexpected ways that consumers use the notes."", ""lead_paragraph"": ""An upbeat new campaign is celebrating the creative possibilities of a product that for decades had been promoted for prosaic purposes."", ""source"": ""The New York Times"", ""multimedia"": [{""rank"": 0, ""subtype"": ""xlarge"", ""caption"": null, ""credit"": null, ""type"": ""image"", ""url"": ""images/2013/01/28/business/media/28adnewsletter1-inline/28adnewsletter1-inline-articleLarge.jpg"", ""height"": 400, ""width"": 600, ""subType"": ""xlarge"", ""crop_name"": ""articleLarge"", ""legacy"": {""xlarge"": ""images/2013/01/28/business/media/28adnewsletter1-inline/28adnewsletter1-inline-articleLarge.jpg"", ""xlargewidth"": 600, ""xlargeheight"": 400}}, {""rank"": 0, ""subtype"": ""jumbo"", ""caption"": null, ""credit"": null, ""type"": ""image"", ""url"": ""images/2013/01/28/business/media/28adnewsletter1-inline/28adnewsletter1-inline-jumbo.jpg"", ""height"": 667, ""width"": 1000, ""subType"": ""jumbo"", ""crop_name"": ""jumbo"", ""legacy"": {}}, {""rank"": 0, ""subtype"": ""superJumbo"", ""caption"": null, ""credit"": null, ""type"": ""image"", ""url"": ""images/2013/01/28/business/media/28adnewsletter1-inline/28adnewsletter1-inline-superJumbo.jpg"", ""height"": 667, ""width"": 1000, ""subType"": ""superJumbo"", ""crop_name"": ""superJumbo"", ""legacy"": {}}, {""rank"": 0, ""subtype"": ""thumbnail"", ""caption"": null, ""credit"": null, ""type"": ""image"", ""url"": ""images/2013/01/28/business/media/28adnewsletter1-inline/28adnewsletter1-inline-thumbStandard.jpg"", ""height"": 75, ""width"": 75, ""subType"": ""thumbnail"", ""crop_name"": ""thumbStandard"", ""legacy"": {""thumbnail"": ""images/2013/01/28/business/media/28adnewsletter1-inline/28adnewsletter1-inline-thumbStandard.jpg"", ""thumbnailwidth"": 75, ""thumbnailheight"": 75}}, {""rank"": 0, ""subtype"": ""thumbLarge"", ""caption"": null, ""credit"": null, ""type"": ""image"", ""url"": ""images/2013/01/28/business/media/28adnewsletter1-inline/28adnewsletter1-inline-thumbLarge.jpg"", ""height"": 150, ""width"": 150, ""subType"": ""thumbLarge"", ""crop_name"": ""thumbLarge"", ""legacy"": {}}], ""headline"": {""main"": ""3M Says, \u2018Go Ahead, Make Something of It\u2019"", ""kicker"": ""Campaign Spotlight"", ""content_kicker"": null, ""print_headline"": ""3M Says, &#8216;Go Ahead, Make Something of It&#8217;"", ""name"": null, ""seo"": null, ""sub"": null}, ""keywords"": [{""name"": ""subject"", ""value"": ""ADVERTISING AND MARKETING"", ""rank"": 1, ""major"": ""N""}, {""name"": ""subject"", ""value"": ""Public Relations and Publicity"", ""rank"": 2, ""major"": ""N""}, {""name"": ""organizations"", ""value"": ""3M Company"", ""rank"": 3, ""major"": ""N""}], ""pub_date"": ""2013-01-28T19:02:04+0000"", ""document_type"": ""article"", ""news_desk"": ""Business"", ""section_name"": ""Business Day"", ""subsection_name"": ""Mutual Funds"", ""byline"": {""original"": ""By Stuart Elliott"", ""person"": [{""firstname"": ""Stuart"", ""middlename"": null, ""lastname"": ""Elliott"", ""qualifier"": null, ""title"": null, ""role"": ""reported"", ""organization"": """", ""rank"": 1}], ""organization"": null}, ""type_of_material"": ""News"", ""_id"": ""nyt://article/2831a3fa-4760-5877-885c-02f4db412991"", ""word_count"": 1563, ""uri"": ""nyt://article/2831a3fa-4760-5877-885c-02f4db412991""}"
2013-09-17,"{""abstract"": ""The 3M Tekk Protection WorkTunes headphones keep excessive noise out, and won\u2019t damage your ears with loud music levels, either."", ""web_url"": ""https://www.nytimes.com/2013/09/19/technology/personaltech/headphones-for-protection-not-cranking-it-up.html"", ""snippet"": ""The 3M Tekk Protection WorkTunes headphones keep excessive noise out, and won\u2019t damage your ears with loud music levels, either."", ""lead_paragraph"": ""Anyone who has read the warnings that come with new headphones knows that cranking music at full volume can permanently harm hearing. The 3M TEKK Protection WorkTunes headphones, however, are meant to protect your hearing, and not just from loud music."", ""source"": ""The New York Times"", ""multimedia"": [{""rank"": 0, ""subtype"": ""xlarge"", ""caption"": null, ""credit"": null, ""type"": ""image"", ""url"": ""images/2013/09/19/technology/19worktunes-span/19worktunes-span-articleLarge.jpg"", ""height"": 538, ""width"": 600, ""subType"": ""xlarge"", ""crop_name"": ""articleLarge"", ""legacy"": {""xlarge"": ""images/2013/09/19/technology/19worktunes-span/19worktunes-span-articleLarge.jpg"", ""xlargewidth"": 600, ""xlargeheight"": 538}}, {""rank"": 0, ""subtype"": ""jumbo"", ""caption"": null, ""credit"": null, ""type"": ""image"", ""url"": ""images/2013/09/19/technology/19worktunes-span/19worktunes-span-jumbo.jpg"", ""height"": 919, ""width"": 1024, ""subType"": ""jumbo"", ""crop_name"": ""jumbo"", ""legacy"": {}}, {""rank"": 0, ""subtype"": ""superJumbo"", ""caption"": null, ""credit"": null, ""type"": ""image"", ""url"": ""images/2013/09/19/technology/19worktunes-span/19worktunes-span-superJumbo.jpg"", ""height"": 1837, ""width"": 2048, ""subType"": ""superJumbo"", ""crop_name"": ""superJumbo"", ""legacy"": {}}, {""rank"": 0, ""subtype"": ""thumbnail"", ""caption"": null, ""credit"": null, ""type"": ""image"", ""url"": ""images/2013/09/19/technology/19worktunes-span/19worktunes-span-thumbStandard.jpg"", ""height"": 75, ""width"": 75, ""subType"": ""thumbnail"", ""crop_name"": ""thumbStandard"", ""legacy"": {""thumbnail"": ""images/2013/09/19/technology/19worktunes-span/19worktunes-span-thumbStandard.jpg"", ""thumbnailwidth"": 75, ""thumbnailheight"": 75}}, {""rank"": 0, ""subtype"": ""thumbLarge"", ""caption"": null, ""credit"": null, ""type"": ""image"", ""url"": ""images/2013/09/19/technology/19worktunes-span/19worktunes-span-thumbLarge.jpg"", ""height"": 150, ""width"": 150, ""subType"": ""thumbLarge"", ""crop_name"": ""thumbLarge"", ""legacy"": {}}], ""headline"": {""main"": ""Headphones for Protection, Not Cranking It Up"", ""kicker"": ""Gadgetwise"", ""content_kicker"": null, ""print_headline"": """", ""name"": null, ""seo"": null, ""sub"": null}, ""keywords"": [{""name"": ""subject"", ""value"": ""Headphones and Headsets"", ""rank"": 1, ""major"": ""N""}, {""name"": ""subject"", ""value"": ""Noise"", ""rank"": 2, ""major"": ""N""}, {""name"": ""subject"", ""value"": ""Ears and Hearing"", ""rank"": 3, ""major"": ""N""}, {""name"": ""organizations"", ""value"": ""3M Company"", ""rank"": 4, ""major"": ""N""}], ""pub_date"": ""2013-09-17T15:41:29+0000"", ""document_type"": ""article"", ""news_desk"": ""Business"", ""section_name"": ""Technology"", ""subsection_name"": ""Personal Tech"", ""byline"": {""original"": ""By Roy Furchgott"", ""person"": [{""firstname"": ""Roy"", ""middlename"": null, ""lastname"": ""Furchgott"", ""qualifier"": null, ""title"": null, ""role"": ""reported"", ""organization"": """", ""rank"": 1}], ""organization"": null}, ""type_of_material"": ""News"", ""_id"": ""nyt://article/54690e19-d035-53a4-884f-71139d1f9192"", ""word_count"": 267, ""uri"": ""nyt://article/54690e19-d035-53a4-884f-71139d1f9192""}"
2013-12-03,"{""abstract"": ""The search giant, which for years has been evasive about its plans for the cloud, is announcing rates and features for a wide-ranging computing service."", ""web_url"": ""https://www.nytimes.com/2013/12/03/technology/google-joins-a-heavyweight-competition-in-cloud-computing.html"", ""snippet"": ""The search giant, which for years has been evasive about its plans for the cloud, is announcing rates and features for a wide-ranging computing service."", ""lead_paragraph"": ""MOUNTAIN VIEW, Calif. \u2014 Google already runs much of the digital lives of consumers through email, Internet searches and YouTube videos. Now it wants the corporations, too."", ""print_section"": ""B"", ""print_page"": ""1"", ""source"": ""The New York Times"", ""multimedia"": [{""rank"": 0, ""subtype"": ""xlarge"", ""caption"": null, ""credit"": null, ""type"": ""image"", ""url"": ""images/2013/12/03/business/Google/Google-articleLarge.jpg"", ""height"": 400, ""width"": 600, ""subType"": ""xlarge"", ""crop_name"": ""articleLarge"", ""legacy"": {""xlarge"": ""images/2013/12/03/business/Google/Google-articleLarge.jpg"", ""xlargewidth"": 600, ""xlargeheight"": 400}}, {""rank"": 0, ""subtype"": ""jumbo"", ""caption"": null, ""credit"": null, ""type"": ""image"", ""url"": ""images/2013/12/03/business/Google/Google-jumbo.jpg"", ""height"": 683, ""width"": 1024, ""subType"": ""jumbo"", ""crop_name"": ""jumbo"", ""legacy"": {}}, {""rank"": 0, ""subtype"": ""superJumbo"", ""caption"": null, ""credit"": null, ""type"": ""image"", ""url"": ""images/2013/12/03/business/Google/Google-superJumbo.jpg"", ""height"": 1365, ""width"": 2048, ""subType"": ""superJumbo"", ""crop_name"": ""superJumbo"", ""legacy"": {}}, {""rank"": 0, ""subtype"": ""thumbnail"", ""caption"": null, ""credit"": null, ""type"": ""image"", ""url"": ""images/2013/12/03/business/Google/Google-thumbStandard.jpg"", ""height"": 75, ""width"": 75, ""subType"": ""thumbnail"", ""crop_name"": ""thumbStandard"", ""legacy"": {""thumbnail"": ""images/2013/12/03/business/Google/Google-thumbStandard.jpg"", ""thumbnailwidth"": 75, ""thumbnailheight"": 75}}, {""rank"": 0, ""subtype"": ""thumbLarge"", ""caption"": null, ""credit"": null, ""type"": ""image"", ""url"": ""images/2013/12/03/business/Google/Google-thumbLarge.jpg"", ""height"": 150, ""width"": 150, ""subType"": ""thumbLarge"", ""crop_name"": ""thumbLarge"", ""legacy"": {}}], ""headline"": {""main"": ""Google Joins a Heavyweight Competition in Cloud Computing"", ""kicker"": null, ""content_kicker"": null, ""print_headline"": ""Google Joins Heavyweight Competition In the Cloud"", ""name"": null, ""seo"": null, ""sub"": null}, ""keywords"": [{""name"": ""organizations"", ""value"": ""Google Inc"", ""rank"": 2, ""major"": ""N""}, {""name"": ""subject"", ""value"": ""Cloud Computing"", ""rank"": 3, ""major"": ""N""}, {""name"": ""organizations"", ""value"": ""AMAZON.COM INC"", ""rank"": 4, ""major"": ""N""}, {""name"": ""organizations"", ""value"": ""International Business Machines Corporation"", ""rank"": 5, ""major"": ""N""}, {""name"": ""organizations"", ""value"": ""3M Company"", ""rank"": 6, ""major"": ""N""}, {""name"": ""subject"", ""value"": ""Data Storage"", ""rank"": 7, ""major"": ""N""}], ""pub_date"": ""2013-12-03T05:01:21+0000"", ""document_type"": ""article"", ""news_desk"": ""Business"", ""section_name"": ""Technology"", ""byline"": {""original"": ""By Quentin Hardy"", ""person"": [{""firstname"": ""Quentin"", ""middlename"": null, ""lastname"": ""Hardy"", ""qualifier"": null, ""title"": null, ""role"": ""reported"", ""organization"": """", ""rank"": 1}], ""organization"": null}, ""type_of_material"": ""News"", ""_id"": ""nyt://article/289a8ac9-edc0-54f0-bb80-78171743b21d"", ""word_count"": 1148, ""uri"": ""nyt://article/289a8ac9-edc0-54f0-bb80-78171743b21d""}"
2014-07-11,"{""abstract"": ""Zack \u201cDanger\u201d Brown can raise more than $43,000 on Kickstarter to pay for his potato salad. Surely there is someone at the Sun Valley conference who can make use of his talents."", ""web_url"": ""https://dealbook.nytimes.com/2014/07/11/weekend-reading-have-you-even-tried-the-potato-salad-in-sun-valley/"", ""snippet"": ""Zack \u201cDanger\u201d Brown can raise more than $43,000 on Kickstarter to pay for his potato salad. Surely there is someone at the Sun Valley conference who can make use of his talents."", ""lead_paragraph"": ""Zack \u201cDanger\u201d Brown can raise more than $43,000 on Kickstarter to pay for his potato salad. Surely there is someone at the Sun Valley conference who can make use of his talents. Or technology and media titans could make use of these delicious potato salad recipes from The New York Times. DealBook recommends Sam Sifton\u2019s grilled fingerling-potato salad with chipotle bacon vinaigrette. Mmm, bacon."", ""source"": ""The New York Times"", ""multimedia"": [{""rank"": 0, ""subtype"": ""xlarge"", ""caption"": null, ""credit"": null, ""type"": ""image"", ""url"": ""images/2014/07/11/business/dbpix-potato-kickstarter/dbpix-potato-kickstarter-articleLarge.png"", ""height"": 512, ""width"": 600, ""subType"": ""xlarge"", ""crop_name"": ""articleLarge"", ""legacy"": {""xlarge"": ""images/2014/07/11/business/dbpix-potato-kickstarter/dbpix-potato-kickstarter-articleLarge.png"", ""xlargewidth"": 600, ""xlargeheight"": 512}}, {""rank"": 0, ""subtype"": ""jumbo"", ""caption"": null, ""credit"": null, ""type"": ""image"", ""url"": ""images/2014/07/11/business/dbpix-potato-kickstarter/dbpix-potato-kickstarter-jumbo.png"", ""height"": 872, ""width"": 1021, ""subType"": ""jumbo"", ""crop_name"": ""jumbo"", ""legacy"": {}}, {""rank"": 0, ""subtype"": ""superJumbo"", ""caption"": null, ""credit"": null, ""type"": ""image"", ""url"": ""images/2014/07/11/business/dbpix-potato-kickstarter/dbpix-potato-kickstarter-superJumbo.png"", ""height"": 872, ""width"": 1021, ""subType"": ""superJumbo"", ""crop_name"": ""superJumbo"", ""legacy"": {}}, {""rank"": 0, ""subtype"": ""thumbnail"", ""caption"": null, ""credit"": null, ""type"": ""image"", ""url"": ""images/2014/07/11/business/dbpix-potato-kickstarter/dbpix-potato-kickstarter-thumbStandard-v2.png"", ""height"": 75, ""width"": 75, ""subType"": ""thumbnail"", ""crop_name"": ""thumbStandard"", ""legacy"": {""thumbnail"": ""images/2014/07/11/business/dbpix-potato-kickstarter/dbpix-potato-kickstarter-thumbStandard-v2.png"", ""thumbnailwidth"": 75, ""thumbnailheight"": 75}}, {""rank"": 0, ""subtype"": ""thumbLarge"", ""caption"": null, ""credit"": null, ""type"": ""image"", ""url"": ""images/2014/07/11/business/dbpix-potato-kickstarter/dbpix-potato-kickstarter-thumbLarge-v2.png"", ""height"": 150, ""width"": 150, ""subType"": ""thumbLarge"", ""crop_name"": ""thumbLarge"", ""legacy"": {}}], ""headline"": {""main"": ""Weekend Reading: Have You Even Tried the Potato Salad in Sun Valley?"", ""kicker"": ""DealBook"", ""content_kicker"": null, ""print_headline"": """", ""name"": null, ""seo"": null, ""sub"": null}, ""keywords"": [], ""pub_date"": ""2014-07-11T20:19:09+0000"", ""document_type"": ""article"", ""news_desk"": ""Business"", ""section_name"": ""Business Day"", ""byline"": {""original"": ""By Eric Owles"", ""person"": [{""firstname"": ""Eric"", ""middlename"": null, ""lastname"": ""Owles"", ""qualifier"": null, ""title"": null, ""role"": ""reported"", ""organization"": """", ""rank"": 1}], ""organization"": null}, ""type_of_material"": ""News"", ""_id"": ""nyt://article/c61b8a46-a41a-572f-ab19-6582e43de1a5"", ""word_count"": 292, ""uri"": ""nyt://article/c61b8a46-a41a-572f-ab19-6582e43de1a5""}"
