Date,Articles
2011-09-20,"{""abstract"": ""Aetna, Humana, Kaiser Permanente and the UnitedHealth Group will supply information about patients\u2019 claims to a nonprofit group."", ""web_url"": ""https://www.nytimes.com/2011/09/20/health/policy/20health.html"", ""snippet"": ""Aetna, Humana, Kaiser Permanente and the UnitedHealth Group will supply information about patients\u2019 claims to a nonprofit group."", ""lead_paragraph"": ""Several major health insurers have agreed to provide their claims data on a regular basis to academic researchers, in an unusual agreement that they say will open a window onto the rising costs of health care."", ""print_section"": ""B"", ""print_page"": ""1"", ""source"": ""The New York Times"", ""multimedia"": [{""rank"": 0, ""subtype"": ""jumbo"", ""caption"": null, ""credit"": null, ""type"": ""image"", ""url"": ""images/2011/09/20/business/Health/Health-jumbo.jpg"", ""height"": 956, ""width"": 1024, ""subType"": ""jumbo"", ""crop_name"": ""jumbo"", ""legacy"": {}}, {""rank"": 0, ""subtype"": ""thumbnail"", ""caption"": null, ""credit"": null, ""type"": ""image"", ""url"": ""images/2011/09/20/business/Health/Health-thumbStandard.jpg"", ""height"": 75, ""width"": 75, ""subType"": ""thumbnail"", ""crop_name"": ""thumbStandard"", ""legacy"": {""thumbnail"": ""images/2011/09/20/business/Health/Health-thumbStandard.jpg"", ""thumbnailwidth"": 75, ""thumbnailheight"": 75}}], ""headline"": {""main"": ""4 Insurers Will Supply Health Data"", ""kicker"": null, ""content_kicker"": null, ""print_headline"": ""4 Insurers Will Supply Health Data"", ""name"": null, ""seo"": null, ""sub"": null}, ""keywords"": [{""name"": ""organizations"", ""value"": ""UnitedHealth Group Inc"", ""rank"": 1, ""major"": ""N""}, {""name"": ""organizations"", ""value"": ""Kaiser Permanente"", ""rank"": 2, ""major"": ""N""}, {""name"": ""organizations"", ""value"": ""Humana Incorporated"", ""rank"": 3, ""major"": ""N""}, {""name"": ""organizations"", ""value"": ""AETNA INCORPORATED"", ""rank"": 4, ""major"": ""N""}, {""name"": ""subject"", ""value"": ""Health Insurance and Managed Care"", ""rank"": 5, ""major"": ""N""}, {""name"": ""subject"", ""value"": ""Research"", ""rank"": 6, ""major"": ""N""}, {""name"": ""subject"", ""value"": ""Prices (Fares, Fees and Rates)"", ""rank"": 7, ""major"": ""N""}], ""pub_date"": ""2011-09-20T01:37:01+0000"", ""document_type"": ""article"", ""news_desk"": ""Business"", ""section_name"": ""Health"", ""subsection_name"": ""Money & Policy"", ""byline"": {""original"": ""By Reed Abelson"", ""person"": [{""firstname"": ""Reed"", ""middlename"": null, ""lastname"": ""Abelson"", ""qualifier"": null, ""title"": null, ""role"": ""reported"", ""organization"": """", ""rank"": 1}], ""organization"": null}, ""type_of_material"": ""News"", ""_id"": ""nyt://article/090d3d91-c9e7-5e99-8e11-43151a626193"", ""word_count"": 901, ""uri"": ""nyt://article/090d3d91-c9e7-5e99-8e11-43151a626193""}"
2011-09-28,"{""abstract"": ""The cost of health insurance this year rose more steeply than in previous years, outstripping wages and adding uncertainty about the pace of growing costs."", ""web_url"": ""https://www.nytimes.com/2011/09/28/business/28insure.html"", ""snippet"": ""The cost of health insurance this year rose more steeply than in previous years, outstripping wages and adding uncertainty about the pace of growing costs."", ""lead_paragraph"": ""Major health insurance companies have been charging sharply higher premiums this year, outstripping any growth in workers\u2019 wages and creating more uncertainty for the Obama administration and employers who are struggling to drive down an unrelenting rise in medical costs."", ""print_section"": ""A"", ""print_page"": ""1"", ""source"": ""The New York Times"", ""multimedia"": [{""rank"": 0, ""subtype"": ""xlarge"", ""caption"": null, ""credit"": null, ""type"": ""image"", ""url"": ""images/2011/09/28/nyregion/jpinsure/jpinsure-articleLarge.jpg"", ""height"": 330, ""width"": 600, ""subType"": ""xlarge"", ""crop_name"": ""articleLarge"", ""legacy"": {""xlarge"": ""images/2011/09/28/nyregion/jpinsure/jpinsure-articleLarge.jpg"", ""xlargewidth"": 600, ""xlargeheight"": 330}}, {""rank"": 0, ""subtype"": ""jumbo"", ""caption"": null, ""credit"": null, ""type"": ""image"", ""url"": ""images/2011/09/28/nyregion/jpinsure/jpinsure-jumbo.jpg"", ""height"": 712, ""width"": 1024, ""subType"": ""jumbo"", ""crop_name"": ""jumbo"", ""legacy"": {}}, {""rank"": 0, ""subtype"": ""thumbnail"", ""caption"": null, ""credit"": null, ""type"": ""image"", ""url"": ""images/2011/09/28/nyregion/jpinsure/jpinsure-thumbStandard.jpg"", ""height"": 75, ""width"": 75, ""subType"": ""thumbnail"", ""crop_name"": ""thumbStandard"", ""legacy"": {""thumbnail"": ""images/2011/09/28/nyregion/jpinsure/jpinsure-thumbStandard.jpg"", ""thumbnailwidth"": 75, ""thumbnailheight"": 75}}], ""headline"": {""main"": ""Health Insurers Push Premiums Sharply Higher"", ""kicker"": null, ""content_kicker"": null, ""print_headline"": ""Health Insurers Push Premiums Sharply Higher"", ""name"": null, ""seo"": null, ""sub"": null}, ""keywords"": [{""name"": ""subject"", ""value"": ""Health Insurance and Managed Care"", ""rank"": 1, ""major"": ""N""}, {""name"": ""subject"", ""value"": ""Patient Protection and Affordable Care Act (2010)"", ""rank"": 2, ""major"": ""N""}, {""name"": ""subject"", ""value"": ""Prices (Fares, Fees and Rates)"", ""rank"": 3, ""major"": ""N""}, {""name"": ""glocations"", ""value"": ""New York State"", ""rank"": 4, ""major"": ""N""}, {""name"": ""organizations"", ""value"": ""MVP Health Care"", ""rank"": 5, ""major"": ""N""}, {""name"": ""organizations"", ""value"": ""AETNA INCORPORATED"", ""rank"": 6, ""major"": ""N""}, {""name"": ""organizations"", ""value"": ""UnitedHealth Group Inc"", ""rank"": 7, ""major"": ""N""}], ""pub_date"": ""2011-09-28T03:14:42+0000"", ""document_type"": ""article"", ""news_desk"": ""Business"", ""section_name"": ""Business Day"", ""byline"": {""original"": ""By Reed Abelson and Nina Bernstein"", ""person"": [{""firstname"": ""Reed"", ""middlename"": null, ""lastname"": ""Abelson"", ""qualifier"": null, ""title"": null, ""role"": ""reported"", ""organization"": """", ""rank"": 1}, {""firstname"": ""Nina"", ""middlename"": null, ""lastname"": ""Bernstein"", ""qualifier"": null, ""title"": null, ""role"": ""reported"", ""organization"": """", ""rank"": 2}], ""organization"": null}, ""type_of_material"": ""News"", ""_id"": ""nyt://article/bf1a98ca-ac42-5bb2-9e74-4410ebcb92b6"", ""word_count"": 1436, ""uri"": ""nyt://article/bf1a98ca-ac42-5bb2-9e74-4410ebcb92b6""}"
2012-01-17,"{""abstract"": ""Health insurers and employers must now pay to screen children for obesity and provide them with counseling. Experts say creating such programs will be a challenge."", ""web_url"": ""https://www.nytimes.com/2012/01/17/health/learning-to-be-lean.html"", ""snippet"": ""Health insurers and employers must now pay to screen children for obesity and provide them with counseling. Experts say creating such programs will be a challenge."", ""lead_paragraph"": ""As one of the many outgrowths of the sweeping federal health care law, health insurers and employers must now pay the cost of screening children for obesity and providing them with appropriate counseling."", ""print_section"": ""B"", ""print_page"": ""1"", ""source"": ""The New York Times"", ""multimedia"": [{""rank"": 0, ""subtype"": ""jumbo"", ""caption"": null, ""credit"": null, ""type"": ""image"", ""url"": ""images/2012/01/17/business/JP-OBESITY2/JP-OBESITY2-jumbo.jpg"", ""height"": 683, ""width"": 1024, ""subType"": ""jumbo"", ""crop_name"": ""jumbo"", ""legacy"": {}}, {""rank"": 0, ""subtype"": ""thumbnail"", ""caption"": null, ""credit"": null, ""type"": ""image"", ""url"": ""images/2012/01/17/business/JP-OBESITY2/JP-OBESITY2-thumbStandard.jpg"", ""height"": 75, ""width"": 75, ""subType"": ""thumbnail"", ""crop_name"": ""thumbStandard"", ""legacy"": {""thumbnail"": ""images/2012/01/17/business/JP-OBESITY2/JP-OBESITY2-thumbStandard.jpg"", ""thumbnailwidth"": 75, ""thumbnailheight"": 75}}], ""headline"": {""main"": ""Learning to Be Lean"", ""kicker"": null, ""content_kicker"": null, ""print_headline"": ""Learning to Be Lean"", ""name"": null, ""seo"": null, ""sub"": null}, ""keywords"": [{""name"": ""subject"", ""value"": ""Obesity"", ""rank"": 1, ""major"": ""N""}, {""name"": ""organizations"", ""value"": ""UnitedHealth Group Inc"", ""rank"": 2, ""major"": ""N""}, {""name"": ""organizations"", ""value"": ""Weight Watchers International Inc"", ""rank"": 3, ""major"": ""N""}, {""name"": ""subject"", ""value"": ""Patient Protection and Affordable Care Act (2010)"", ""rank"": 4, ""major"": ""N""}, {""name"": ""subject"", ""value"": ""Health Insurance and Managed Care"", ""rank"": 5, ""major"": ""N""}, {""name"": ""subject"", ""value"": ""Children and Childhood"", ""rank"": 6, ""major"": ""N""}], ""pub_date"": ""2012-01-17T01:07:18+0000"", ""document_type"": ""article"", ""news_desk"": ""Business"", ""section_name"": ""Health"", ""byline"": {""original"": ""By Reed Abelson"", ""person"": [{""firstname"": ""Reed"", ""middlename"": null, ""lastname"": ""Abelson"", ""qualifier"": null, ""title"": null, ""role"": ""reported"", ""organization"": """", ""rank"": 1}], ""organization"": null}, ""type_of_material"": ""News"", ""_id"": ""nyt://article/d720fadb-eaf3-547e-b308-a60ad28a2a65"", ""word_count"": 1258, ""uri"": ""nyt://article/d720fadb-eaf3-547e-b308-a60ad28a2a65""}"
2012-01-20,"{""abstract"": ""Fourth-quarter profit rose 21 percent, to $1.26 billion, or $1.17 a share, compared with $1.04 billion, or 94 cents a share, a year earlier."", ""web_url"": ""https://www.nytimes.com/2012/01/20/business/unitedhealths-profit-increases-beating-estimates.html"", ""snippet"": ""Fourth-quarter profit rose 21 percent, to $1.26 billion, or $1.17 a share, compared with $1.04 billion, or 94 cents a share, a year earlier."", ""lead_paragraph"": ""UnitedHealth Group, the nation\u2019s largest health insurer by sales, reported fourth-quarter earnings Thursday that beat analysts\u2019 estimates after the company gained members and controlled costs."", ""print_section"": ""B"", ""print_page"": ""2"", ""source"": ""The New York Times"", ""multimedia"": [], ""headline"": {""main"": ""UnitedHealth Beats Forecasts"", ""kicker"": null, ""content_kicker"": null, ""print_headline"": ""UnitedHealth Beats Forecasts"", ""name"": null, ""seo"": null, ""sub"": null}, ""keywords"": [{""name"": ""organizations"", ""value"": ""UnitedHealth Group Inc"", ""rank"": 1, ""major"": ""N""}, {""name"": ""subject"", ""value"": ""Company Reports"", ""rank"": 2, ""major"": ""N""}, {""name"": ""subject"", ""value"": ""Health Insurance and Managed Care"", ""rank"": 3, ""major"": ""N""}], ""pub_date"": ""2012-01-20T00:51:31+0000"", ""document_type"": ""article"", ""news_desk"": ""Business"", ""section_name"": ""Business Day"", ""byline"": {""original"": ""By Bloomberg News"", ""person"": [{""firstname"": ""Bloomberg"", ""middlename"": null, ""lastname"": ""News"", ""qualifier"": null, ""title"": null, ""role"": ""reported"", ""organization"": """", ""rank"": 1}], ""organization"": null}, ""type_of_material"": ""News"", ""_id"": ""nyt://article/19ad11d6-2bf9-5f8c-9ff4-b6600d96ff70"", ""word_count"": 275, ""uri"": ""nyt://article/19ad11d6-2bf9-5f8c-9ff4-b6600d96ff70""}"
2012-06-11,"{""abstract"": ""UnitedHealth says it will continue offering some of the popular consumer protections required by the federal health care law, even if the Supreme Court strikes down the entire law later this month."", ""web_url"": ""https://www.nytimes.com/2012/06/11/health/unitedhealth-to-offer-protections-in-health-law-even-if-it-is-struck-down.html"", ""snippet"": ""UnitedHealth says it will continue offering some of the popular consumer protections required by the federal health care law, even if the Supreme Court strikes down the entire law later this month."", ""lead_paragraph"": ""The UnitedHealth Group, one of the nation\u2019s largest health insurers, announced Sunday night that it planned to continue offering some of the popular consumer protections required by the federal health care law, even if the Supreme Court declares the entire law unconstitutional later this month."", ""print_section"": ""B"", ""print_page"": ""8"", ""source"": ""The New York Times"", ""multimedia"": [], ""headline"": {""main"": ""Health Law Ruling Won\u2019t Alter Plans by Insurer"", ""kicker"": null, ""content_kicker"": null, ""print_headline"": ""Health Law Ruling Won\u2019t Alter Plans By Insurer"", ""name"": null, ""seo"": null, ""sub"": null}, ""keywords"": [{""name"": ""organizations"", ""value"": ""UnitedHealth Group Inc"", ""rank"": 1, ""major"": ""N""}, {""name"": ""organizations"", ""value"": ""Supreme Court"", ""rank"": 2, ""major"": ""N""}, {""name"": ""subject"", ""value"": ""Health Insurance and Managed Care"", ""rank"": 3, ""major"": ""N""}], ""pub_date"": ""2012-06-11T04:11:01+0000"", ""document_type"": ""article"", ""news_desk"": ""Business"", ""section_name"": ""Health"", ""byline"": {""original"": ""By Reed Abelson"", ""person"": [{""firstname"": ""Reed"", ""middlename"": null, ""lastname"": ""Abelson"", ""qualifier"": null, ""title"": null, ""role"": ""reported"", ""organization"": """", ""rank"": 1}], ""organization"": null}, ""type_of_material"": ""News"", ""_id"": ""nyt://article/6ae02eb6-9455-5939-b36a-1edc2a7c28dc"", ""word_count"": 349, ""uri"": ""nyt://article/6ae02eb6-9455-5939-b36a-1edc2a7c28dc""}"
2012-10-08,"[{""abstract"": ""The UnitedHealth Group agreed on Monday to buy a 90 percent stake in the Brazilian health care provider Amil Participa\u00e7\u00f5es for $4.9 billion, as the American insurer looked to expand in the fast-growing country."", ""web_url"": ""https://dealbook.nytimes.com/2012/10/08/unitedhealth-to-buy-majority-stake-in-brazilian-healthcare-company-for-4-9-billion/"", ""snippet"": ""The UnitedHealth Group agreed on Monday to buy a 90 percent stake in the Brazilian health care provider Amil Participa\u00e7\u00f5es for $4.9 billion, as the American insurer looked to expand in the fast-growing country."", ""lead_paragraph"": ""8:52 a.m. | Updated "", ""print_section"": ""B"", ""print_page"": ""2"", ""source"": ""The New York Times"", ""multimedia"": [], ""headline"": {""main"": ""UnitedHealth to Buy Control of Brazilian Company for $4.9 Billion"", ""kicker"": ""DealBook"", ""content_kicker"": null, ""print_headline"": ""UnitedHealth to Buy 90% of Brazilian Provider"", ""name"": null, ""seo"": null, ""sub"": null}, ""keywords"": [{""name"": ""subject"", ""value"": ""Mergers, Acquisitions and Divestitures"", ""rank"": 1, ""major"": ""N""}, {""name"": ""persons"", ""value"": ""Hemsley, Stephen J"", ""rank"": 2, ""major"": ""N""}, {""name"": ""organizations"", ""value"": ""Amil Participacoes SA"", ""rank"": 3, ""major"": ""N""}, {""name"": ""organizations"", ""value"": ""UnitedHealth Group Inc"", ""rank"": 4, ""major"": ""N""}, {""name"": ""glocations"", ""value"": ""Brazil"", ""rank"": 5, ""major"": ""N""}], ""pub_date"": ""2012-10-08T11:26:15+0000"", ""document_type"": ""article"", ""news_desk"": """", ""section_name"": ""Business Day"", ""byline"": {""original"": ""By Mark Scott"", ""person"": [{""firstname"": ""Mark"", ""middlename"": null, ""lastname"": ""Scott"", ""qualifier"": null, ""title"": null, ""role"": ""reported"", ""organization"": """", ""rank"": 1}], ""organization"": null}, ""type_of_material"": ""News"", ""_id"": ""nyt://article/b01cd1d7-bbc4-5d90-97cf-57a2284f305f"", ""word_count"": 338, ""uri"": ""nyt://article/b01cd1d7-bbc4-5d90-97cf-57a2284f305f""}, {""abstract"": ""Regulators are getting help policing the rapid-fire markets from an unlikely source \u2014 the rapid-fire traders. | Insiders say Twitter is aiming to go public in 2014. | President Obama has a Wall Street problem in Silicon Valley. | The UnitedHealth Group strikes a deal to expand in Brazil."", ""web_url"": ""https://dealbook.nytimes.com/2012/10/08/a-regulatory-odd-couple/"", ""snippet"": ""Regulators are getting help policing the rapid-fire markets from an unlikely source \u2014 the rapid-fire traders. | Insiders say Twitter is aiming to go public in 2014. | President Obama has a Wall Street problem in Silicon Valley. | The UnitedHealth ..."", ""lead_paragraph"": ""The Odd Couple: The S.E.C. and High-Frequency Traders \u00a0|\u00a0 Regulators are getting help policing the rapid-fire markets from an unlikely source \u2014 the rapid-fire traders. Tradeworx, 45-person high-speed trading firm based in New Jersey, has designed a program that will allow the Securities and Exchange Commission to see every bid and offer on each of the nation\u2019s 13 public stock exchanges. \u201cThe system, akin to an X-ray machine for the stock market, could enable regulators to detect whether trading firms are overwhelming the market\u2019s plumbing when they rapidly submit and cancel orders,\u201d Nathaniel Popper and Ben Protess write in The New York Times. While critics contend the program is akin to \u201cthe fox guarding the hen house,\u201d the trading firm defends its partnership with regulators. \u201cWhere else are they going to be able to get these capabilities?\u201d said Manoj Narang, the chief executive of Tradeworx."", ""source"": ""The New York Times"", ""multimedia"": [], ""headline"": {""main"": ""A Regulatory Odd Couple"", ""kicker"": ""DealBook"", ""content_kicker"": null, ""print_headline"": """", ""name"": null, ""seo"": null, ""sub"": null}, ""keywords"": [], ""pub_date"": ""2012-10-08T12:33:18+0000"", ""document_type"": ""article"", ""news_desk"": """", ""section_name"": ""Business Day"", ""byline"": {""original"": ""By William Alden"", ""person"": [{""firstname"": ""William"", ""middlename"": null, ""lastname"": ""Alden"", ""qualifier"": null, ""title"": null, ""role"": ""reported"", ""organization"": """", ""rank"": 1}], ""organization"": null}, ""type_of_material"": ""News"", ""_id"": ""nyt://article/eb166256-707a-5c7a-a538-fac8560a9e38"", ""word_count"": 1994, ""uri"": ""nyt://article/eb166256-707a-5c7a-a538-fac8560a9e38""}]"
2013-02-14,"{""abstract"": ""The National Federation of Nurses expects to gain more political clout and money by affiliating with the American Federation of Teachers."", ""web_url"": ""https://www.nytimes.com/2013/02/14/business/seeking-growth-nurses-union-links-to-teachers-union.html"", ""snippet"": ""The National Federation of Nurses expects to gain more political clout and money by affiliating with the American Federation of Teachers."", ""lead_paragraph"": ""One of the nation\u2019s largest nurses\u2019 unions \u2014 the National Federation of Nurses \u2014 plans to announce on Thursday that it will affiliate with the far larger American Federation of Teachers. "", ""print_section"": ""B"", ""print_page"": ""4"", ""source"": ""The New York Times"", ""multimedia"": [{""rank"": 0, ""subtype"": ""xlarge"", ""caption"": null, ""credit"": null, ""type"": ""image"", ""url"": ""images/2013/02/14/business/Labor/Labor-articleLarge.jpg"", ""height"": 400, ""width"": 600, ""subType"": ""xlarge"", ""crop_name"": ""articleLarge"", ""legacy"": {""xlarge"": ""images/2013/02/14/business/Labor/Labor-articleLarge.jpg"", ""xlargewidth"": 600, ""xlargeheight"": 400}}, {""rank"": 0, ""subtype"": ""jumbo"", ""caption"": null, ""credit"": null, ""type"": ""image"", ""url"": ""images/2013/02/14/business/Labor/Labor-jumbo.jpg"", ""height"": 683, ""width"": 1024, ""subType"": ""jumbo"", ""crop_name"": ""jumbo"", ""legacy"": {}}, {""rank"": 0, ""subtype"": ""superJumbo"", ""caption"": null, ""credit"": null, ""type"": ""image"", ""url"": ""images/2013/02/14/business/Labor/Labor-superJumbo.jpg"", ""height"": 1365, ""width"": 2048, ""subType"": ""superJumbo"", ""crop_name"": ""superJumbo"", ""legacy"": {}}, {""rank"": 0, ""subtype"": ""thumbnail"", ""caption"": null, ""credit"": null, ""type"": ""image"", ""url"": ""images/2013/02/14/business/Labor/Labor-thumbStandard.jpg"", ""height"": 75, ""width"": 75, ""subType"": ""thumbnail"", ""crop_name"": ""thumbStandard"", ""legacy"": {""thumbnail"": ""images/2013/02/14/business/Labor/Labor-thumbStandard.jpg"", ""thumbnailwidth"": 75, ""thumbnailheight"": 75}}, {""rank"": 0, ""subtype"": ""thumbLarge"", ""caption"": null, ""credit"": null, ""type"": ""image"", ""url"": ""images/2013/02/14/business/Labor/Labor-thumbLarge.jpg"", ""height"": 150, ""width"": 150, ""subType"": ""thumbLarge"", ""crop_name"": ""thumbLarge"", ""legacy"": {}}], ""headline"": {""main"": ""Seeking Growth, Nurses\u2019 Union Links to Teachers\u2019 Union"", ""kicker"": null, ""content_kicker"": null, ""print_headline"": ""Seeking Growth, Nurses\u2019 Federation Links to Teachers\u2019 Union"", ""name"": null, ""seo"": null, ""sub"": null}, ""keywords"": [{""name"": ""subject"", ""value"": ""Organized Labor"", ""rank"": 1, ""major"": ""N""}, {""name"": ""persons"", ""value"": ""Greenhouse, Steven"", ""rank"": 2, ""major"": ""N""}, {""name"": ""subject"", ""value"": ""Nursing and Nurses"", ""rank"": 3, ""major"": ""N""}, {""name"": ""organizations"", ""value"": ""AMERICAN FEDERATION OF TEACHERS"", ""rank"": 4, ""major"": ""N""}, {""name"": ""organizations"", ""value"": ""National Nurses United"", ""rank"": 5, ""major"": ""N""}], ""pub_date"": ""2013-02-14T02:07:08+0000"", ""document_type"": ""article"", ""news_desk"": ""Business"", ""section_name"": ""Business Day"", ""byline"": {""original"": ""By Steven Greenhouse"", ""person"": [{""firstname"": ""Steven"", ""middlename"": null, ""lastname"": ""Greenhouse"", ""qualifier"": null, ""title"": null, ""role"": ""reported"", ""organization"": """", ""rank"": 1}], ""organization"": null}, ""type_of_material"": ""News"", ""_id"": ""nyt://article/d0ed5f7e-7868-579a-9258-fb64fdbcf99f"", ""word_count"": 521, ""uri"": ""nyt://article/d0ed5f7e-7868-579a-9258-fb64fdbcf99f""}"
2013-10-11,"{""abstract"": ""In the exchanges created by the Affordable Care Act, Blue Cross and Blue Shield plans offer name recognition and price advantages."", ""web_url"": ""https://www.nytimes.com/2013/10/11/business/blue-cross-plans-jump-to-an-early-lead.html"", ""snippet"": ""In the exchanges created by the Affordable Care Act, Blue Cross and Blue Shield plans offer name recognition and price advantages."", ""lead_paragraph"": ""Color the new online insurance marketplaces Blue."", ""print_section"": ""B"", ""print_page"": ""1"", ""source"": ""The New York Times"", ""multimedia"": [{""rank"": 0, ""subtype"": ""xlarge"", ""caption"": null, ""credit"": null, ""type"": ""image"", ""url"": ""images/2013/10/11/business/BLUE/BLUE-articleLarge.jpg"", ""height"": 369, ""width"": 600, ""subType"": ""xlarge"", ""crop_name"": ""articleLarge"", ""legacy"": {""xlarge"": ""images/2013/10/11/business/BLUE/BLUE-articleLarge.jpg"", ""xlargewidth"": 600, ""xlargeheight"": 369}}, {""rank"": 0, ""subtype"": ""jumbo"", ""caption"": null, ""credit"": null, ""type"": ""image"", ""url"": ""images/2013/10/11/business/BLUE/BLUE-jumbo.jpg"", ""height"": 630, ""width"": 1024, ""subType"": ""jumbo"", ""crop_name"": ""jumbo"", ""legacy"": {}}, {""rank"": 0, ""subtype"": ""superJumbo"", ""caption"": null, ""credit"": null, ""type"": ""image"", ""url"": ""images/2013/10/11/business/BLUE/BLUE-superJumbo.jpg"", ""height"": 1259, ""width"": 2048, ""subType"": ""superJumbo"", ""crop_name"": ""superJumbo"", ""legacy"": {}}, {""rank"": 0, ""subtype"": ""thumbnail"", ""caption"": null, ""credit"": null, ""type"": ""image"", ""url"": ""images/2013/10/11/business/BLUE/BLUE-thumbStandard.jpg"", ""height"": 75, ""width"": 75, ""subType"": ""thumbnail"", ""crop_name"": ""thumbStandard"", ""legacy"": {""thumbnail"": ""images/2013/10/11/business/BLUE/BLUE-thumbStandard.jpg"", ""thumbnailwidth"": 75, ""thumbnailheight"": 75}}, {""rank"": 0, ""subtype"": ""thumbLarge"", ""caption"": null, ""credit"": null, ""type"": ""image"", ""url"": ""images/2013/10/11/business/BLUE/BLUE-thumbLarge.jpg"", ""height"": 150, ""width"": 150, ""subType"": ""thumbLarge"", ""crop_name"": ""thumbLarge"", ""legacy"": {}}], ""headline"": {""main"": ""Blue Cross Plans Jump to an Early Lead"", ""kicker"": null, ""content_kicker"": null, ""print_headline"": ""Blue Cross Plans Jump to an Early Lead"", ""name"": null, ""seo"": null, ""sub"": null}, ""keywords"": [{""name"": ""persons"", ""value"": ""Abelson, Reed"", ""rank"": 1, ""major"": ""N""}, {""name"": ""organizations"", ""value"": ""Blue Cross and Blue Shield Assn"", ""rank"": 2, ""major"": ""N""}, {""name"": ""subject"", ""value"": ""Health Insurance and Managed Care"", ""rank"": 3, ""major"": ""N""}, {""name"": ""subject"", ""value"": ""Patient Protection and Affordable Care Act (2010)"", ""rank"": 4, ""major"": ""N""}, {""name"": ""organizations"", ""value"": ""WellPoint Inc"", ""rank"": 5, ""major"": ""N""}, {""name"": ""organizations"", ""value"": ""AETNA INC"", ""rank"": 6, ""major"": ""N""}, {""name"": ""organizations"", ""value"": ""UnitedHealth Group Inc"", ""rank"": 7, ""major"": ""N""}, {""name"": ""subject"", ""value"": ""Regulation and Deregulation of Industry"", ""rank"": 8, ""major"": ""N""}], ""pub_date"": ""2013-10-11T00:56:49+0000"", ""document_type"": ""article"", ""news_desk"": ""Business"", ""section_name"": ""Business Day"", ""byline"": {""original"": ""By Reed Abelson"", ""person"": [{""firstname"": ""Reed"", ""middlename"": null, ""lastname"": ""Abelson"", ""qualifier"": null, ""title"": null, ""role"": ""reported"", ""organization"": """", ""rank"": 1}], ""organization"": null}, ""type_of_material"": ""News"", ""_id"": ""nyt://article/2aec44e0-9052-597c-994c-540e9614f4be"", ""word_count"": 1346, ""uri"": ""nyt://article/2aec44e0-9052-597c-994c-540e9614f4be""}"
